id,username,fullname,email,password_hash,phone,country,gender,birthday,creation_date,pfp_file_id,bio
0cea3b72-afd2-49ef-97b1-5d4eabc49a14,scottemily8647,Patricia Evans,brownemily@example.com,a22028bf1dd4761fc470c4e0756bc92b2964a1b725dba8821b9ab8adf20cba9e,+1-250-816-0625x776,Austria,M,1967-11-11,2023-09-21 19:38:30.712549,91c5160f-be0a-412a-9edf-6bf18b14fedf,"Bring upon after candidate send sing meet. Level today line travel night form example.
Situation authority argue research sister within wall. Ball create little test general."
089b607f-2723-4e17-99ce-1344e98347ef,hensleyeduardo3382,David Silva,lmunoz@example.com,b593e7dfd7cfcb6e113cd640635d36ea1a0be2ce79a7e8fd726e1f80e3930097,(303)261-3126x7272,Uruguay,,1951-11-09,2023-09-21 19:38:30.712939,6439cff5-1f24-4381-a8ba-360c6e7cfed6,"Threat property almost quickly less different. Early strong time political. Time two could machine. Perform all along.
Price participant grow good. Myself east industry hope sit section. Fish article pull century produce city street model."
a65e52ad-a0c7-4347-b1a4-90d8f8195d39,patricia436634,Michelle Stewart,qthomas@example.org,e4fa018b99d81b3480789276d16d55b958c8dca468e1e59f9dac96c00428c062,(869)981-4914,Guyana,,2008-11-03,2023-09-21 19:38:30.713334,4292a9e9-c3a4-440c-8d21-cabd3559f618,"Interview central drive agreement public. Save increase concern purpose affect film. War floor for happen entire week.
Analysis level stay nice training young. Stand back mind stop worry."
bf48edb8-6e53-4d36-a87d-bda507a2489d,robinsonbeth9460,Elizabeth Smith,johnsonryan@example.net,fa35a9a610dc27896fe2e7970c9ebe9c8f00ff36b63c198956b72232243a770d,001-102-076-1237x87699,Sudan,M,1916-04-03,2023-09-21 19:38:30.713760,a21b49a4-a31b-4580-a910-aff6d957e117,"Agree smile single measure small career significant. Money how red politics life she. Key include according.
Cell media arrive. Every over treat talk. Not focus image per late."
a771e0a3-3584-4f92-8d8d-ae11c1960126,dfreeman3612,Dale Terry,leslie51@example.net,a7f482e9d0df338084df8119c37f2ace94f24a3fa6160a570896aa521fc8729f,432-547-1517x299,Congo,,2003-01-03,2023-09-21 19:38:30.714163,2491d0d2-64bb-4628-a0ad-17d322e3c876,"Radio only stay turn office whole. Cold tree wonder a including employee product. Anyone both side blue.
His visit music support. East second pass human subject look. Contain machine worker knowledge skin view bit."
3541f721-2137-4c30-99f5-6bcc2cda5b10,lyonssarah7690,Tiffany Miller,bramos@example.org,10912fa357359c01c916d8b3faadda183206accfaa5349f14a092f84e599e846,(182)968-5430x3682,Mayotte,,2004-12-14,2023-09-21 19:38:30.714551,f7a21252-da93-4a7e-9428-fac25ae42486,Party air water image. Benefit begin hold second. Mr night statement live economic information. General thought the.
22c49bee-453a-47d0-bde5-4551b75343f5,ctodd5310,Jason Morrow,smithadam@example.net,3f3167fa6ec858e38acb522697983a4d1fb30a300f0242bcb3d8df481b0ba700,837-283-7182,Seychelles,,1914-01-23,2023-09-21 19:38:30.714982,c37c87a5-39e7-48b2-8b8f-a0079b8133ef,"Force huge nor local.
Care keep cultural young physical pretty write. Rise dream guy hotel others civil apply yet. Indicate course bar early plan seat south onto.
Tree his card everybody administration."
2d5358b7-54f6-447f-a143-c4e33e17a15f,heatherkramer3312,Jonathan Scott,nathan84@example.com,70abc3b31e618b017ed45e31b4400e89778034404b5326d162697b8cc3ed3b4a,994-705-0593,Papua New Guinea,F,1954-11-03,2023-09-21 19:38:30.715348,66d5b79f-a2fd-4d6f-9b2d-65acbbf6d4e6,"Single without course day quickly. Like eight itself walk huge big.
Source region share way wait indicate old. Issue meeting approach loss owner face. Hold small material.
Today store production expert general by call."
77d425fd-abf7-48b9-8b19-259ac8237501,normanschaefer7490,Donald Brown,hmorales@example.com,53e25f4fc1bad79d86709424cdbd0512810c9d329f95d98653a854029195f469,610-368-8921x606,Madagascar,M,1976-04-13,2023-09-21 19:38:30.715733,02997f3c-3262-4d13-9e68-6b705fb13062,"Final how wait admit avoid institution. Record would either inside. Trip this effort black do.
Most actually country lead writer. Increase something tend same off scientist.
Tonight and after during just present several. State read culture process agent."
0b464ad9-d901-4295-b8fb-aca4062b0e92,omontoya7187,Joseph Lucero,diane82@example.net,b18b455b583ba67440500b6406c3d77caabf062a97e27292ec768f4201336397,+1-708-542-5372x28374,Thailand,F,1936-07-24,2023-09-21 19:38:30.716137,8e7a6b4a-8ca1-4689-8ac3-4ba942a9835d,"Maybe always very hear. Instead area myself. Sing rule visit president beautiful. Site push time fact moment.
Two under past each economy. So organization strategy door. Baby artist future discover huge phone."
500b27e1-618f-42ee-b1cd-1502925a3a5d,joseph629323,Justin Bush,oortega@example.com,d681ee91e0528173e25d685801121ffee41794f697f6aeea4a735bb5306ce361,(495)698-8805,Sri Lanka,F,1941-05-10,2023-09-21 19:38:30.716523,02997f3c-3262-4d13-9e68-6b705fb13062,"Force available treatment skill school respond. Author friend really challenge.
More down arrive. Kitchen mission television big plant company authority provide."
9b67d855-64be-456f-bc5f-782afede9f7c,campbellkathleen3146,Sean Edwards,danashelton@example.net,697fe0d7d9033998a2d37661e0973658105f6b160ae4646144627216be68bedc,541.260.1250,Zambia,M,2002-04-28,2023-09-21 19:38:30.716949,0a7e571c-fe18-4781-89f4-77f076350ef9,"Half someone official week. Or hour list since professional your.
Sometimes weight arrive dark rise. Lot hair house throw eye though report teacher. Science carry watch total too have.
Data baby fact each go. All need tell instead green investment might."
3c3536cf-4df6-4549-ac50-6eec79a97d70,ejones7207,Joshua Hanson,austinvalencia@example.com,3893aa0b4376a9f83e0dbec388d22d580146ce97929c1accb2f2eb168c88b926,+1-130-622-2391x634,Solomon Islands,F,1919-12-30,2023-09-21 19:38:30.717394,0e110900-c93f-42e2-ad8a-9b127dc121c7,"Culture himself open discuss apply smile. Him a discussion either.
Career experience group impact event themselves service thank."
9ab0534a-bf9d-4384-8079-a38939836bf2,bradshawmaria4948,Charles Wyatt,benjaminlewis@example.com,6c173ccc2bc6dbe21792a373e5b228561b764e849b19f732ee122ce3b994ec30,146-746-9217,Netherlands,F,2011-01-11,2023-09-21 19:38:30.717810,a24b7ece-120a-4146-89ef-03e36642989a,"Office year close while score charge. Tonight public might more.
Ahead also eye difficult officer environment from.
Simply call foreign husband scene ready. Through pass agreement ten card."
8ccd33d6-ea5b-4595-a6e8-747f5f3ffd5b,cmurphy8977,Christopher Harper,randall83@example.org,4d80ff947190efd93de49f9b97a6d470827483aa4937d8953564c447f73bde85,542.620.3147x2954,Panama,,1914-10-28,2023-09-21 19:38:30.718192,39c0abc9-08a2-4e33-abe2-5c339b48dbe6,"She evidence something never only. Organization Mr sit science teacher build person very. Stage early even. Design stage cell effort minute our.
Face outside many foot voice. Share may current political."
7b470e66-c326-4db3-af69-64b1fb8fd9f5,dgilbert2737,Keith Cain,dana35@example.org,1687d79575e2db04fef4e64dc799a7a71b94bacf046086d97a966966f86a912f,+1-516-548-2873x30097,Singapore,F,1940-10-19,2023-09-21 19:38:30.718558,1aaa4b04-c8b9-4ac4-9450-d2c0595dc51c,"Pretty few form. Gun view direction point approach community I meeting.
Feel allow with news. Economy effort crime travel.
Against require bad already price research democratic. Six ability home name begin finish."
d652db30-1e0e-4689-a32d-8fa7f71838df,brittanystone824,Kenneth Hobbs,scox@example.com,95dc83a17ef874a8a6da5c7fb19f8a63a030af8489ba3320877c413511290e7a,397-225-5305,Bhutan,M,1950-04-12,2023-09-21 19:38:30.718950,83cfd94d-3ab0-4a91-8faa-4bd4543e0dcf,"Yard Mr occur. Interest can this condition agree others practice among.
Avoid south good store my matter figure. Newspaper maybe well method available truth between staff."
ec2c2d31-4e4c-4af7-816a-103c10682c3c,nunezchristopher361,Sheila Blankenship,danielleacosta@example.com,1afeace9831138c4307e02624c97071d85505974a56160adca68d8b313e2bd65,(660)720-6398x24123,Antigua and Barbuda,F,1925-04-07,2023-09-21 19:38:30.719378,8e7a6b4a-8ca1-4689-8ac3-4ba942a9835d,"Practice too race into eat run theory. Special finish successful magazine. Deal price get but place.
Throw whole general throughout shoulder possible provide front. Anyone trial bad rise."
d8e24f2d-bad9-4355-9d16-d7ce6cf8953c,david104452,Jennifer Lynch,thompsonlaura@example.com,d5fce874cbfc8e8d8da0db5be0930d930e43b7f0ff03511c70ba293014002a8a,270.156.0489x7333,Trinidad and Tobago,,1975-03-16,2023-09-21 19:38:30.719816,78f2af2d-4826-4da7-8c83-30331c666318,"Break night nearly situation whether. Article spring born because station think which. Few person start.
Player of economic yes should. Product list throughout appear new herself teacher."
2345d937-b47d-4367-9f90-c915615a7c6b,erinbowman7014,James Escobar,deborahbullock@example.org,0a7c29f72b07f002e939d24ca990637931df783df23c34cdd4ca06b60b6b7fe0,966.441.7755x6113,Malaysia,M,1971-01-15,2023-09-21 19:38:30.720382,41fa6a69-1ffb-4d08-81a0-dc9d2727ce12,"Style management much return when. Talk recognize student season forward. Do occur second these head state but page.
Picture measure sort ability on talk. Whom behavior into respond.
Market bar cause. Thus point too argue."
bad31ab9-7cd2-422b-a23c-9919061026fe,alyssajones4510,Nicholas Smith,bsanchez@example.com,5137357490fa74d8e3d9ff8336b0f3ff41c2d76445993aabf6b940cc68e3074b,676-154-1506x4949,San Marino,,1933-03-08,2023-09-21 19:38:30.720863,f7a21252-da93-4a7e-9428-fac25ae42486,Control contain southern forward behind sell financial forget. Here especially personal above agree movement. Move some his board none response religious.
0d3799ee-6632-4c15-a9bf-7d68a47b43ec,millergarrett4379,Chad Walker,wilsonshane@example.com,15fe679579a3c0e9db2f46312b087f60c2a4a7b7f7258905121ab0861213c70e,0429778939,Slovakia (Slovak Republic),F,1944-12-24,2023-09-21 19:38:30.721293,68062038-bb68-47da-9170-11048a8fbbf6,"Factor mind care single.
Seem who rather green. Environment per smile wide image air."
37568297-c31a-4cae-b277-f74e50021a0b,sullivanduane8936,Haley Jones,adamsnina@example.net,751a57e4a36269778bd0f2773335766c01d4a34372046f58361193da30e69d8c,682.629.9649x333,Mozambique,F,1991-07-03,2023-09-21 19:38:30.721731,cd7ab579-5a2c-4d39-9385-84eb16e6a859,"Develop society bag street whole. Game behind as age growth time these.
Play actually camera go all turn seem international. Important their standard history guy knowledge.
Movement man whose turn wish model get. Common less director mind."
fc205db6-bf6c-458c-846e-8a6678b81db3,morrisamy2173,Michelle Alvarez,jonathan76@example.net,9aca1d1556fc207fbdd373f6b731cfd302b0ffb6523e8c142167468fcc35d107,440.768.0361x1204,Congo,F,1982-11-29,2023-09-21 19:38:30.722130,b1f14783-45cb-4821-b96b-c0bd2a937a92,"Sell yet avoid suggest source others. Say sell like response rather. Can size give foot.
Example manage important old sing. Decade say have cut."
74522b59-8115-4a77-9c66-efd2bf4b6417,ccarter4984,Kimberly Townsend,james74@example.com,a314c2b1a30c17f9bc9918c950e9c5009a75dd9dd85de202c5ce8c3ba1732489,(923)854-3088x497,Portugal,,1913-05-07,2023-09-21 19:38:30.722498,db824885-00d0-42b3-9dea-cb6448aca119,Respond station collection read game claim of room. Whatever want must structure money.
2f704293-4e87-471c-8f8d-cc50260579ab,melissa966669,Carrie Collins,gomezjaime@example.net,6b42db6a772f978c44a21a594bdd8f846e4af9676a49187f5afee580f990f90b,028-865-9165x7025,Saudi Arabia,F,1955-04-14,2023-09-21 19:38:30.722931,73cba461-5271-497a-bfaa-741e5bfe9fb2,"Discussion action government amount easy choose think. Step field character address machine threat positive. For program arm.
Reduce improve draw off. Page already lot lot ready since. Increase thus but certain dream culture seat."
352bf190-b8b9-4152-9cde-b4474b96a675,richardnoble7253,Mark Sullivan,zrojas@example.org,0ee2d07ca1fcdd415ca78016774dccf026338b94c68e12426530e7f6c83e7185,001-779-550-2146x9576,Romania,,1929-09-18,2023-09-21 19:38:30.723322,0a7e571c-fe18-4781-89f4-77f076350ef9,"Send rock born building. State national material education west traditional history.
Manage culture man special still himself write. Professional late itself.
Song peace culture leader. Practice piece six foot significant dog. Quality close white nearly."
e746e01d-a3a6-473d-a892-d024c7046a9c,smithkaren6388,Michael Patel,vvaughn@example.com,699e9c8cd2354cd56c574643ec3186a3bdb0fee71769a434b62eaf420bd60570,571.680.9066x97343,Ecuador,,1960-08-31,2023-09-21 19:38:30.723934,78f2af2d-4826-4da7-8c83-30331c666318,"Itself bad road. Water reality personal language left. Close become weight rich loss such. Real none development.
Professor receive lose whether rate.
Question finish both have system push source. Along only available. Store six language thing be old."
8702e369-13ec-4855-9d69-4a44db1e5021,brianhernandez6064,Robert Smith,bsawyer@example.com,5c9ef3b62dfec3d8592880025dd15f45f98b7ee103f4cba88cc35cd5cf6018cb,(376)047-9106x802,Mexico,M,1913-10-20,2023-09-21 19:38:30.724353,16210e52-c5e6-4e62-a9ba-d6b41af7be64,"Front bank whose scene name camera majority. Site many may person change.
Her remain lawyer role but see. Break approach effect save oil total.
Population test customer sell. Crime improve ability might kid realize. Child ability world because ahead."
5e95073c-6386-4fe2-bcc1-407ab19dbbb8,kenneth177199,Jennifer Turner,lewisheather@example.net,33b13d6820ee7b83b7ee5ae933a80e59df1aab6f0fd33200fe82c7f8bc610d99,(480)644-3585,Finland,F,1933-06-18,2023-09-21 19:38:30.724796,4292a9e9-c3a4-440c-8d21-cabd3559f618,"Cell throw personal there land term cost. Life issue account space final once.
Hundred clear certainly form analysis college arm. Yourself throughout skill certainly hospital south. Necessary seem do lay century all ago about."
55a50805-0011-4e24-a092-66ad104e2f23,williamchen3052,Paul Nunez,nicole15@example.com,faab77e60df61d4e56d40a784d00a043b1b44007ab90db787685040429befee9,772.444.3525x12613,Nigeria,F,1932-04-07,2023-09-21 19:38:30.725171,ce617c43-f551-4b81-963f-76f7e472cc00,"Coach just fish field. Husband marriage article tend everyone hour. Spring deal beat everything treatment finally time.
Simply alone present seven hard sport. Rule buy live eye six garden official health. Current Mrs major whom board policy."
7e5e963f-f1af-4bf5-bc24-95ee586d5af1,zrice858,Jonathan Cameron,debra89@example.org,361988e5e54e3ae19973f9b2030ea47f144ed103df22e27382d5bd98b611533e,380-612-3532x458,Hong Kong,M,2018-04-10,2023-09-21 19:38:30.725550,47855aae-8419-4ffc-8810-494d01ae0450,"Hard inside current. Determine four mean. Young idea down reflect item.
Feel knowledge data wish star together. Film happy affect significant I speech point. These police common after identify he."
0602a653-8720-44b9-ac12-62ae6e3dc1c1,golson6949,Catherine Roberts,gloriabennett@example.net,c98440acd3b0e40328beae00ba31645a4f10c5297c5ba2f8ea1b0cd70c115884,252.347.7898x808,Heard Island and McDonald Islands,F,1917-11-08,2023-09-21 19:38:30.726001,39c0abc9-08a2-4e33-abe2-5c339b48dbe6,"Book so political manager must answer. Business pick spring myself enjoy.
Family pattern toward after. Take top whom. Own worker artist product democratic. Dream option front up decide.
East require your use than prepare life. While partner past stay any."
77ab81f4-0476-4637-b50f-783c6ae1c1d8,barbarajackson2569,Jerry Cooper,sburns@example.net,980a935647b48ba1e3d7446fd47b8457541375771841034285326973bfeb61ac,+1-498-445-0229x6545,New Zealand,M,1913-07-21,2023-09-21 19:38:30.726421,bb4dde68-16d1-49fb-bbd2-0e4922ddc448,"Safe show me each maintain. Decade give wish computer few. Real we with people fish sure why record. This benefit certainly whether benefit debate.
Control perform door cause staff treat daughter play. Interview try decision speech south determine return."
bb19f793-e936-4333-8f24-7c6821f5e724,jennifergreen4641,Laura Russo,albert64@example.net,f1081b95849c352a7f9237904394cafb88c3617eb7c4859b04fb463006ca96f3,036.698.6675,Uganda,M,1953-12-30,2023-09-21 19:38:30.726787,1ad77cc0-4e93-4302-b4df-8096def3292d,"Attention nature service himself front painting system. Single relate language now himself.
Summer report impact across treatment term six. Mean list bar difference help choose one. Arm peace hope."
12e1484e-1a98-4313-a988-592cd917a81c,aguilaralex836,Carolyn Roberson,qortiz@example.com,78fdd86037370dceaa8b16736605169965505ab58dc8500d7572eb0eb6377464,9246246561,Croatia,F,1926-09-14,2023-09-21 19:38:30.727187,b84c8891-f142-490b-904f-666f4155b21b,Bit report feeling trip idea inside. Hear window good human along. Sing television whatever.
75718fcc-c917-4856-b8e1-6314cbb0b9ac,smartinez1561,Shelia Guzman,mikaylacooper@example.net,89769921d838d18c4c36980f9b58a45c8b89b0d7a3ddbe2de161aee60ff7bd75,001-325-580-3693,Brunei Darussalam,M,1940-04-01,2023-09-21 19:38:30.727602,ce617c43-f551-4b81-963f-76f7e472cc00,"Loss question use plan mention. Catch conference entire case western. Story safe remember direction drive resource address.
Ahead how world toward issue west protect."
35040c9a-06b4-4288-8dc0-698a20fb95cd,davidcardenas474,Eddie Larson,martinezdanny@example.net,10908f0421e593c80a91f03f453494722c71ea1c3a376cd7510cbb2f6726d06d,(756)916-5584x309,Indonesia,F,1923-12-26,2023-09-21 19:38:30.728039,eb8b564c-9517-427d-894d-07227a9e6933,"Thus air science off example song suddenly. As five order whether car maintain.
Understand financial voice economy amount wonder property. Information future spring trip. Subject during whole who cold bar resource."
5c20bba8-6cf1-4059-98be-b5beeb4f1808,scottmartinez5522,Cynthia Norton,juan93@example.com,03e9a9fe2c0aa211ba04b774fa60d12558afc76fa6f022dd52f48952070a2f88,004.117.0707x0623,India,M,1926-07-29,2023-09-21 19:38:30.728415,91cb7bb6-551f-4855-bc91-f4e61a1db5c6,"Available draw tend man. Pm nothing paper let. Election yes politics might. Outside build start political.
Material we style sit support individual. Forget pressure woman campaign everyone carry. Exactly bed week standard cause."
c8b19f49-c880-46cf-b1b0-150844793d1e,gary276065,Latoya Garcia,penatabitha@example.org,694f247874b097962568642c362976d5dbdfeaca9a86b0e92950c724eeb4a8dd,(005)988-8466x77386,Dominica,M,2019-01-03,2023-09-21 19:38:30.728861,0a51fdfb-2490-4fb0-b6d5-9f40eff9ee3d,"Rule computer term main sort third time door. Range challenge news significant can dream.
Son society throw wall few research. Yeah forward law public whatever write low mother.
Least check church image notice show hot. Success somebody sure which."
a7d8925a-09b2-48eb-9cc0-dbc8f132ef79,rodriguezjohn4763,Judy Norman,virginia08@example.org,21655d22fea6df23f28ced97fb58f9a85063970743bb0e44f725069cee6093b6,001-079-917-0476,Tuvalu,,2021-01-09,2023-09-21 19:38:30.729242,6d7169fd-95dc-488e-86c7-3082712f04b4,"Man rest financial material positive short. Create down bag today country. Certainly cut bill whether parent simply.
While forget truth benefit. Discussion go offer method."
e6149594-ed89-4d39-aab8-2f93e13d839c,lrobinson6292,Lauren Sheppard,margaretbrown@example.com,04447659e19412dd53323f4e14c0610f8ad911ac2046c76568f24abb89ac7bdb,(942)702-6023,Kiribati,M,1972-09-24,2023-09-21 19:38:30.729671,75b10c11-f2fc-4cb0-9d54-0626a24c18ba,"Newspaper standard pressure total hot. Culture finish ability now. Watch short wide stay enough network.
Treat man claim example. None suffer Republican color turn spend right four. Two morning avoid."
4ed6dc92-6b5b-4728-ab4f-7e4d5bd96ff6,brettlarson9285,Kenneth Blackburn,sherryhouston@example.com,0e85093a1275563eafb1951f3b4f6dd3cd10ba49e8811b2139222420897b39bc,(671)237-0224,Kenya,M,2012-06-08,2023-09-21 19:38:30.730117,bb5d01f6-f1ab-4b60-9041-ef33de0b5910,"Soon capital than interest challenge evening discover. Dark our street age door our production.
Measure firm finish follow former debate. Also call stay security arm ball international. Because station important."
345841f6-a6e6-45fc-996e-32f19e53cc61,jessicahernandez7648,Spencer Marks,cannonchristine@example.com,67413aba61fb0da59b787ba37cd79b5e736e9d9b5ea41738c336f71d34f01813,(665)643-6456x86225,Jamaica,F,1929-08-10,2023-09-21 19:38:30.730555,ce617c43-f551-4b81-963f-76f7e472cc00,"Although somebody writer best specific country. Poor style strategy human information. Sea top offer well.
Voice build central little back. Age see analysis thing area ago goal. Detail bed design value."
0fbf1a33-5b7c-40be-a6d9-307628b87d14,nicole063868,Sarah Wong,sheppardkathryn@example.net,639f42457cf10ae98fd7a299fb31ae5c11bc0d618d5fb519372a5bc6b61f4403,+1-358-114-3580x751,Canada,F,1968-08-24,2023-09-21 19:38:30.731000,b84c8891-f142-490b-904f-666f4155b21b,"Physical learn story security yeah. Into create interest general. Final herself because mission bad she.
Before wonder remember guy. Best detail standard while."
e62fb296-649a-4049-80ec-3bc4f6b09e59,kathleenhill9372,Mr. Anthony Johnson,charlesmiller@example.net,4120b99e56a2d0c0012e8575a335f5b678e6fcf7f542061ecbfdacad13955176,(111)651-0334x640,Kazakhstan,F,1927-12-28,2023-09-21 19:38:30.731434,e6d147d5-c781-4e05-9d4a-2ba03eb8fa74,"Consider shoulder doctor by return quickly color. Similar history like billion senior.
Better executive popular pick though use. Sell across kind try.
Instead suffer pressure. Authority several answer trouble. Just parent officer act realize we."
354140fa-983e-4afe-ae73-f3ac6ef7046d,velazquezpatricia7795,Jeffrey Jackson,mike50@example.org,ff4286409a0886462098afa844a5309e9df05e24a6f6bdbd7744dc695bdad21d,388-553-9937,Azerbaijan,,1990-07-27,2023-09-21 19:38:30.731816,1f0b5d3a-a01e-431e-a2e4-c0479aa1a59a,"Whose tax tend major together yeah town. Bill ago appear situation. Learn happen determine only shoulder when.
His environmental test morning still poor. Dinner write cultural talk."
76e04ecd-8fdb-4e7b-9c09-e75517f22a57,rmyers4395,Karen Black,ythomas@example.net,1582d170ed74b5e35e008f111fb9ddf186c4b0a00893125be2f59f83017b85ea,001-947-779-3712x9202,Libyan Arab Jamahiriya,M,1993-08-09,2023-09-21 19:38:30.732218,f4fe3018-7a47-401a-be5b-3d56e2b602f8,"Report strategy particularly fish herself including bad. Choose miss social pass ball spring so.
Read us oil democratic visit. Democrat vote rest finally market exist."
a14aa214-d20c-4bf3-aeb6-76a87eb59d98,wayne57693,Douglas Clark,duncansonya@example.org,f4a833922be2e3940696ce7086f5066e81053aa4fc589e5fa2b00289ffa88fba,485.032.5285x85362,Italy,,2008-09-18,2023-09-21 19:38:30.732647,f4fe3018-7a47-401a-be5b-3d56e2b602f8,"Reveal hit population general church stand. First would both key. Energy begin military any. Recently present affect physical.
Office hair charge. Tough enter move why shoulder name. Word student big watch."
af5c0d60-9ed4-4db1-a675-0fc9abee302f,milesrebecca7815,April Olsen,ashleyluna@example.net,ae96362742151e4c59c26c131c2580281a7647d95e745589c66cbcbcba8da54e,(814)972-4231x61103,Chile,,2016-07-22,2023-09-21 19:38:30.733109,68062038-bb68-47da-9170-11048a8fbbf6,"One sense hope reduce view. Reveal fight staff hit total sister deal.
Strategy court main sea score on. Up on education word cut. Student type likely development just."
b07d7e89-6250-4480-9a30-636b3754c0d6,larry908347,Jonathan Thompson,lewisjulia@example.net,b199cd37c8802d52a98458511aa5681c15a2adfefc0227793d639af99ce4878f,110-463-6413x0240,Gibraltar,M,1924-08-11,2023-09-21 19:38:30.733528,571db548-0bd4-414d-9034-ab9e90add56f,"Consumer back hear none. Small range public chance alone none network. Allow race still arm fund bar.
Serve but kitchen brother. Institution clear unit represent."
954469f5-f49f-4db2-8404-e21b2498b3cf,nicolebates4843,William Moore,elizabethcampbell@example.com,8ee65b1fba47b5cc993d48d6e79f82ed3efe2482ff0e29441a5a3691fdf58a0c,1402180155,Antigua and Barbuda,M,1973-03-30,2023-09-21 19:38:30.733959,6041070c-cf9b-42ae-bc1e-92fb74fab9be,"Fire body decade picture. Great particularly blood air meet see something bed. Herself charge individual protect think kitchen total.
Rate your point each much simply section. Memory author such carry present law."
454cefa4-16dd-41ed-8e02-afbc80030af4,christopher449576,Angel Grimes,anthonylester@example.net,d11af5c224ee484803ba948f61144ada1849ba505dbe74e3f89e313d95f0f259,+1-396-584-4764x225,Jamaica,F,1957-05-06,2023-09-21 19:38:30.734387,fd718343-047f-4d77-82e0-e97db1ba8921,"Even single subject help dog good. Check explain establish similar according. Never vote everything identify.
Under near include we different. Eight send onto indicate deep war."
b57f2ed8-60b4-44ab-9f7d-8bfeaa2a4943,brian833942,Jennifer Schroeder,timothynichols@example.org,bc58b1adc2d77f58ea062c1a4d5b88f54437f347ccc6312a253d8f700079728a,9889208728,Ghana,F,1975-01-19,2023-09-21 19:38:30.734971,893b4521-ea09-4ffa-b21f-0b9e7259ef62,"Home glass market wide effect certain. White into show message various.
Study win do discover where and energy. Want wind wish pass without. Or bill benefit pressure discover she he."
8f1b48ed-e9dc-4786-8719-d4d6984bbd3c,thomas996912,Autumn Johnson,jacob75@example.org,a1a9921f06b3569f89b0a7bddf28769bff29d0fe4c61cf5c66857e0fafd8433e,978.955.7991x191,Malta,,1917-05-31,2023-09-21 19:38:30.735430,bb4dde68-16d1-49fb-bbd2-0e4922ddc448,"Fish enter nearly challenge option happy. Thing eight series other.
Day painting both I car. Wish something relate stop.
Upon doctor form give. Must step service grow analysis city."
1a971b3e-44d4-4537-89e5-7e1300f2809a,peterschristina9724,Phillip Walker,tatejeffery@example.org,ef98149c328c08421cc3a3190a5369d5c3abe3a686be6e95393ce2f6b96a2dab,(959)063-0693x71851,Malta,M,1932-09-07,2023-09-21 19:38:30.735881,161c6a94-1947-4b57-ab42-1d44db065157,"Reflect real gas responsibility source check design. Space suggest college science whole miss others. Debate return actually carry consumer.
Choose wide to page themselves. Before deal try hope environmental. Yet see mind month young gas place."
