id,username,fullname,email,password_hash,phone,country,gender,birthday,creation_date,pfp_file_id,bio
f615c9dc-c2b5-4c7b-a62f-4b007529f498,llopez8136,Joshua Robertson,marisawilliams@example.org,d6669a0f16f18278edc56f6b54c4cf201955142c768d5dd7422dac38f5eca56a,631.118.0928,Italy,F,1908-11-01,2023-09-21 19:38:30.498919,4292a9e9-c3a4-440c-8d21-cabd3559f618,"Last admit believe until. Good environment wish operation executive.
Skill management democratic produce many choice design. Rule could argue fight present Mr move."
ca883f0d-335a-43ee-989c-f794a962b54b,michaelrichardson529,Jennifer Perez,kellymosley@example.com,9702280880c0a548f0c523710b8f47ba685be9ba294a5d615c4c6f5eb1f27e13,795.699.5830x4178,Anguilla,M,2016-08-02,2023-09-21 19:38:30.499347,78f2af2d-4826-4da7-8c83-30331c666318,"Half receive music.
Him father opportunity view necessary might town. With operation soon long.
Raise compare wrong whatever animal. Past pretty perform anyone. Free particularly choice college its per part hold. Blood point movie during you cup able."
0a93d9d8-e99a-4592-a657-afe820b0413c,orodriguez7,Paul Parks,anthony51@example.org,c16a27cffc3caebe6cf6ab823848f15990507082dd362d44c3f584b0a2d45eba,148.151.2868x9595,Burkina Faso,,1913-09-02,2023-09-21 19:38:30.499727,0a51fdfb-2490-4fb0-b6d5-9f40eff9ee3d,"Budget beautiful camera focus north collection prevent.
Between weight case. Foreign easy practice difference.
Recent international even control know. Find outside friend kid.
Special say college small pull despite degree. Away question always."
7bb78620-3666-4804-9d02-9907dc23af3e,john082190,Vincent Jimenez,pestrada@example.com,45b5bbf06532d5d80794eb1a25ccd48a197677f56c2cfdbb22dc4a0f2d1c3bd9,002.107.6804x8218,Philippines,M,1949-05-26,2023-09-21 19:38:30.500140,5ac310f3-2182-486d-b02d-34e8f0b5db34,"Never add second friend. Economic method edge that same. Child television significant sea analysis really us. Television thousand then without worry leg.
Which suggest past near still since name. Quality wish before probably."
41e35d52-826f-4984-8cc5-d3b67e53ddc7,laura536750,Jennifer Sosa,hubbardsusan@example.net,324e0530074e5226f6df6b006b6c509b93098800f048a34c61e8c4fd79aa500a,423.417.5819x8749,Congo,M,1941-12-25,2023-09-21 19:38:30.500577,1aaa4b04-c8b9-4ac4-9450-d2c0595dc51c,"Kitchen sound light quality difference tonight family space. Carry thought strategy doctor now minute according Mrs. Contain finally ahead president.
Arm subject away nearly else."
d1a4f19c-91c8-4991-8c17-ffd5ed0d7d37,ascott4499,Brandy Rojas,brian49@example.com,35c56b8c926397e158a061eed996d2bce34cda3ad3a67df041b41245d072b9d5,(037)690-7621x9623,Cayman Islands,M,1929-12-19,2023-09-21 19:38:30.500942,bcfdbe58-2ba0-4667-a34a-a5812450cbc4,"Main night speech until account someone. Gun my responsibility item win deal.
Consumer economic green rather them avoid school. Discover news spend wrong. Message sense memory likely."
a9969d19-6978-4c4f-89eb-62e3b939f30b,reginald681152,Michael Mccormick,stephaniejenkins@example.org,a2fabe36fc9e4fddde45241499aa29f4e96d3ea4b4e94fc76d3381b0b2d7ee90,001-800-618-4713,Liberia,F,1936-01-12,2023-09-21 19:38:30.501368,05b4f243-878e-4bd6-91a8-680fb87c67ce,"Answer deal for often.
Realize inside reach action. Service we star better step almost.
Big compare design. Eye a generation hot. Second reason number trouble.
Technology bed former have ready. Employee subject stop show occur."
1d123410-95c5-49c7-b67b-234cb5c77e42,steinbrian1304,Gabrielle Taylor,whitecindy@example.net,8ee361e6035a89e92ce5fdd6a77c2b675d8a6abe105f9eddadb97cb105d65ce5,(487)634-7442,Iceland,,1962-12-18,2023-09-21 19:38:30.501829,364efa46-16e1-43e4-9f12-211d647085f2,"Court consider laugh prevent defense. Detail staff into step least.
Think must realize yes month crime trip. Service bill create campaign not stay. Close identify final left summer source risk. Realize general lay yard argue meeting."
eaefc4dd-1f99-4e4b-9b6c-1c61a84ca569,booneamy2612,Kristina Ruiz,clayton09@example.org,b08f9df2e536d5b01c17b72b95de8b07d1a81c549b33f5c3420bb5a565e0c7e8,(220)987-0869,Jordan,,1948-05-09,2023-09-21 19:38:30.502207,b719a06c-ace1-4a65-bd16-da3f0e36385d,"No possible run despite listen. Season know bill drug away second.
Probably western process role. At quickly season across since assume. Say particular card decade."
6728aa11-4680-4d66-bedd-3e78361459d9,carolyn708048,Adam Reyes,morgankatrina@example.org,cacfad5f248499324f21fef3592e94ac8e646c57cdfcd32feac4725a921a38bb,363-386-7207x418,Canada,,1959-01-19,2023-09-21 19:38:30.502637,39c0abc9-08a2-4e33-abe2-5c339b48dbe6,"Operation that factor your also. Education rock impact weight entire truth. Matter business challenge a tax free now.
Sort value cover not. Pull exactly appear her wear him when. Item would moment letter cup thousand least."
1625dd05-4d20-4669-958a-c0879562b8ce,david29494,Megan Johnson,qthomas@example.net,4d04d159b1088359c92a2835bb78895685fd9148e53d12c53790e62f4f74a128,001-467-408-2311x46806,Lithuania,M,1934-03-30,2023-09-21 19:38:30.503041,b84c8891-f142-490b-904f-666f4155b21b,"Remember middle own. Task walk little rate almost third choose. Should push top issue tend special including.
Long moment responsibility style red pick top case. Community sure camera. Low various approach no."
a984e2c1-82bb-4cdf-895f-31e11d354078,anna956081,Amy Waters,john68@example.net,6a50710bce80c6d499468d303b646e126e98b9dfeb5461a622635b0185fd355a,299.727.9009,Vanuatu,M,1985-03-03,2023-09-21 19:38:30.503407,18290c76-2403-4777-8d5f-1b72bb77919e,"Want debate prevent wrong seven. Office party itself kind box partner of.
Pm foreign station born red check soldier. Left rise behind deal today computer born people. Cost wear fund race represent could conference."
15540611-47f7-4655-936b-bcb5ebc985c0,jeffrey26842,William Day,mbishop@example.org,bc38ad8286a1ccae9aeb1f6a34d859b564f376223a785e46378dbc8238916977,+1-567-496-6291x726,Afghanistan,,1910-08-09,2023-09-21 19:38:30.503791,3752fe07-642b-4eb9-a466-02c8ea2c5030,"Amount measure help single performance red. Hear out natural source. Almost half section.
Near term middle. Customer brother four face me once hair cover.
Yeah act someone cost book unit kid director. Its pick bar."
329017cc-6976-465d-880f-ec09ba252119,iolson405,Sherri Drake,jeannegamble@example.org,d1c171941e73b8f21c8102b8fde6dea4bf66782c2d9fc2bf38e8d1cf0767bdf4,+1-418-912-1795x9726,Grenada,,1934-10-17,2023-09-21 19:38:30.504253,bbbd3b02-bceb-46a3-860d-2210b960dcd7,"Analysis well free reflect bring. President remain over.
A wonder attention big oil country how. Congress religious prepare west social player agent."
fbb13e0c-b2b8-4e17-8b77-5341fc39fe6f,rwilliams8853,Stephanie Johnson,jenniferbrock@example.com,a77e872d04a4d371f89de6a678c404ec5f14866edb3d1ed2a4036d1ca288b6ce,9030838772,San Marino,F,1984-12-20,2023-09-21 19:38:30.504679,1e8d297b-ea85-4c30-8b93-4961a713c352,"Positive machine spend eat. Positive as run.
Care too edge like him own green nothing. Analysis bed statement Congress she old discover party. Possible by seat he expert government."
5faa9243-ca1d-47a5-af0a-fa7c87e6ac3e,jasonchapman8513,Kyle Lewis,guzmanernest@example.com,4fcaeb6f4c468fdca527b3a260a04b52fb0cabf74002763c71577bf3d2033a87,985-978-6445x4467,French Polynesia,M,1962-11-22,2023-09-21 19:38:30.505118,68062038-bb68-47da-9170-11048a8fbbf6,"City black next.
Leave focus traditional pressure car. Represent court explain central.
Leave benefit him important other speak or describe. Figure several who region. Mission security move edge."
1fb8e92a-f8ee-4ca9-bc55-f426c25ab3a1,david601096,Eric Martin,vryan@example.org,9d9ab1b01ff775205684cf36f1b327cdbad318cc23b418748c137bce6098970e,583-372-1502x65091,Saint Pierre and Miquelon,M,1990-12-17,2023-09-21 19:38:30.505517,1aaa4b04-c8b9-4ac4-9450-d2c0595dc51c,"Long appear number investment. Part three clear.
Heart be imagine be travel improve. Foreign test money apply company behavior behind early. Face professional represent last seek three then."
318eeae0-5f69-48d2-bae5-7a50f26a174a,douglasobrien5064,Misty Miller,timothygibson@example.org,927fefb17eb9e30b2aed2b2156e72b9ff4711ce9a5a250c98bd2561e414e4645,(282)512-7753,Falkland Islands (Malvinas),F,1942-08-02,2023-09-21 19:38:30.505946,5ac310f3-2182-486d-b02d-34e8f0b5db34,"Player specific the above. Government performance key tough professor less several. Catch less area rest.
Leg sell better PM. Peace order three rock. Beautiful sister affect experience news card."
9ad97983-1b05-4909-a17b-34053588fe98,savagemike4436,Paul Lloyd,ibarnett@example.org,04b76241ee8888848adebce6c60943276a578fad9bf0cc20f15df354aeaaabd1,288.183.1319x02613,Portugal,M,2014-11-04,2023-09-21 19:38:30.506497,cd7ab579-5a2c-4d39-9385-84eb16e6a859,"Main president sea table way help Mr art. Student seven company create color mention movement. Family long stuff fish.
Wide onto bed start several. Move yard meet effort arm now necessary behavior."
ace9e5f1-d9e9-4672-a2c9-d7b1564d8e3a,meghan497189,Rebecca Barr,johnlewis@example.org,33a931efb867098ec067e0acac68dd17204111e060890080f8d8a9d59a8f9b21,(076)915-2618x9069,Nepal,F,1935-09-09,2023-09-21 19:38:30.507143,0f113b66-cea5-4d3d-bf70-3aaa433f10cc,"Remember attack only strong continue. Lot enough let dog political address life. Reveal seven cover determine child law prevent.
Size arm task. Artist bar suddenly ball human improve poor. Land garden challenge phone news crime."
a4efee35-11c8-4429-afe6-b8231bdaafc9,lisa655606,Carrie Willis,ztrujillo@example.org,b5321789dcf215e0c830dc1c044c5ee646f7499dc5730535eb4bbce97acd547c,+1-348-279-2049,Bolivia,M,1923-06-30,2023-09-21 19:38:30.507634,0a51fdfb-2490-4fb0-b6d5-9f40eff9ee3d,"Girl customer occur goal trouble while ago. Agency edge difficult top policy wind surface drug.
Reach officer large tax important everyone real see. Shoulder design take price face economy store. Physical foot conference now."
47a8abc1-de27-4650-8332-246b67127a75,dustinhall8514,Megan White,matthewwatts@example.com,3138137ef2af00e2077e33aa64497c2d92cde0d4515e561d6231b1bcf6d31f1c,+1-062-652-5150x1625,Australia,M,1914-10-29,2023-09-21 19:38:30.508104,5481f72e-64e5-4bc7-b78e-b4bcd109ebfb,"More behavior ability discussion like future. Per woman strong accept law star beyond.
Everyone various both best. Today course give public suffer. Should want yeah.
Where maintain allow could may. Speech heavy responsibility question difficult."
41e9520b-f3a3-4e9c-9dc2-c237c2b860cf,davidewing632,Mark Neal,bbentley@example.com,64959a5b812a1a26fc65fc5e5cac03c8c58c8f9239fda06b007e7bd8e3c005de,(735)182-0984,Estonia,M,1954-05-31,2023-09-21 19:38:30.508506,a24b7ece-120a-4146-89ef-03e36642989a,"I stay everyone pick right. Opportunity environmental through contain model behavior scientist.
Throw expert service forward point image. Congress vote visit who character. Business always than suffer ground."
2a3d0317-ccd9-4ebe-887a-5b8f3ce79b77,matthewalvarez1402,Dana Brown,ryan98@example.net,7d8482ef2a00842c0fb3751ac438e71a4ea509c9212cc776ae3a1ac3363b01fd,(009)896-3746x47096,Papua New Guinea,,1970-05-23,2023-09-21 19:38:30.508896,893b4521-ea09-4ffa-b21f-0b9e7259ef62,"Affect effect political dream else order.
Figure provide industry general land. Recently contain success floor news. Trouble type detail participant. She continue record tell bar computer maintain."
1be5509a-2d21-4c78-84da-9beffca2b36b,tpowell5141,Joshua Lindsey,ramosteresa@example.com,3de92134bce3538d644ed9ee1fc12cf2983e7ee543cb4e64a1dd2928d73ee93d,865-505-8947,Bhutan,,1939-06-22,2023-09-21 19:38:30.509323,a1ceb1d4-deb8-4a4f-a2f3-d8530009f18b,"Take summer girl necessary theory analysis be road. Health would why major debate effect position six.
Fight main feel recent. Me image include source certain light food. Property probably moment detail religious administration."
0d3a9484-0663-460d-aba5-e8c117c4a742,amatthews9873,Christopher Bailey,ocontreras@example.com,60b4bb297cf500fb2fef98361faf273bd9df8f863f6e517f1865787e7bfa3856,(311)909-4506x00135,Nigeria,M,1976-06-29,2023-09-21 19:38:30.509709,bb4dde68-16d1-49fb-bbd2-0e4922ddc448,"Consider point enjoy hit more center their.
Still parent memory others other. Seat main inside southern.
Mind summer shoulder allow meet best argue scientist.
Others trade accept run similar mother bring. Capital southern claim."
16b07206-f91f-4c0a-8104-61f79cf078fc,brucegibson915,Connor Stewart,hillcatherine@example.net,3f97efb3fab379e458a37b2868b5dbdb24d35eac13744e62f4b19d5e0a2a329e,(860)264-3160,Uzbekistan,,1992-10-08,2023-09-21 19:38:30.510174,c37c87a5-39e7-48b2-8b8f-a0079b8133ef,"Answer job social fast reason around apply. Support everybody someone.
History push really. Lawyer red same black positive.
Not television manager drug yourself born. Company when PM despite statement senior."
8fde32d2-caac-498e-9720-fb725571f76e,kbrown173,Jason Serrano,bblack@example.org,fcec30d2b1ec875d9fd5eb631977bc3cf92284707d8c59a9648e391f97cc97ab,899-887-9595,Micronesia,M,1928-09-29,2023-09-21 19:38:30.510564,94abacc9-2eca-443f-8eae-0903124db268,"Democrat watch put away really particularly business. I song close factor themselves issue little. Choose rise condition clearly car imagine could.
Describe enough can site up explain. Part development want large so any wrong staff. Raise method ok lose."
dd809dfc-4c9e-41b0-a887-fc3859dea7d7,lisaoconnor9110,Michael Lewis,yorkjennifer@example.net,2622afb480278573994f31e1073aeea390c05c19ed3d58c34f91a6903498891f,(716)785-2476,Moldova,M,1938-05-22,2023-09-21 19:38:30.511001,5481f72e-64e5-4bc7-b78e-b4bcd109ebfb,"Wear successful ago president through. Throughout still too including.
Owner test prepare actually recognize church watch happen.
Run military environment. Letter as site model movie sea meet."
1615cd69-c5bb-4fb8-adf2-bd42f6bc2a51,slopez7841,Sandra Simmons,dmolina@example.net,3edf639d43b2fdc2484c0976e34e20ba205b1415f2116cba0b6700454b427ffb,663.557.2677,Saint Kitts and Nevis,,1995-09-06,2023-09-21 19:38:30.511382,39c0abc9-08a2-4e33-abe2-5c339b48dbe6,"Seem organization increase outside stage consumer. Safe should computer paper. Will all require tell throw exist.
Pressure enjoy so east us safe most. Institution total most also your before."
b26f5918-4072-448f-b1df-1ebbef3a4207,esimpson2258,Nancy Beltran,atkinstravis@example.org,f9fda56ae8999e6d9fbefeb6ab0bb3988fa5d4f4e3457e3143b1664551980f0c,549-831-4223,Hong Kong,,2008-04-27,2023-09-21 19:38:30.511810,61bb769c-e6e2-41e6-9150-668db73f0ce1,"Bring stock technology clearly trouble.
Action believe ask. Husband century right yard cold.
Person plant while myself coach although. Pull less huge hope usually win evidence. Meet reason interest Mrs consider political."
7bb4b72c-b30f-48a3-aa1e-f4a9c1e110f2,luis065912,Tiffany Gonzalez,adamsashley@example.net,a61f0334d8fedbb7e81f2423ad3b36c7ce7d4f3cf71f2c2712bf1cfd77ce7129,465-733-2657x645,Cambodia,M,2017-03-13,2023-09-21 19:38:30.512267,bb4dde68-16d1-49fb-bbd2-0e4922ddc448,"Television however office. Main factor base anyone Republican process simply.
Especially those particular pay ball. Though else alone wear. Medical include like service town rest late population. Site reach too music officer."
96839694-0680-4057-a099-2bdbeeeefa34,ralphrangel8636,James Sexton,ojenkins@example.org,f54029e6d0ff2ba1614ffcb9f5a16872d4f0729f36032fec02952f84605597e3,958.994.1194,Aruba,F,1946-08-27,2023-09-21 19:38:30.512658,6423b9f0-cc3b-44c1-9ac0-8480034a3c9e,"Appear area end. Entire enjoy read hundred.
Thing civil father once player green. Easy low civil that let tough. Economy those local dinner seem manager start."
2a42a8e4-b443-42e6-bbd7-be5d32400869,willie441510,Brian Murphy,allen10@example.com,d7916cff39314b6c2d6764c3aa25ba69bbc2782f186c9157e617335a2ce6be1e,730.650.5428x9608,Guam,F,1980-02-27,2023-09-21 19:38:30.513037,737af595-d782-41ac-b736-387c76da4c4d,"Likely high heavy middle hope onto movie drive. Letter provide personal skill feel.
Contain own onto alone upon possible song. Water significant course education many whose several skin."
fa309fe2-0478-4e26-8eda-60491e0028bd,jason649450,Jacob Hooper,johnsonjames@example.net,f609c16708b8a6883784d1543fefaef28ed0b81b0a225805f5783e9750acfb64,+1-050-124-0755x89134,Oman,M,1980-08-22,2023-09-21 19:38:30.513456,ac585ea2-69c0-4bbf-9d31-5d0a9e1b671e,"Become do here eat include fight never. Father evidence prevent prepare front floor hot world. For growth summer little.
Will focus majority walk nothing design finally that. Increase score nice through film. I western rate much. Rather pull teach."
53c2cfeb-6cec-4955-9854-5a0a0d02af42,judyrodriguez3191,Karen Torres,phillipserin@example.org,15e0e0c2c49813ac457777b010abfb88c5493770056b0d127376727bc7758bd8,001-450-915-5863x716,Kenya,M,1982-12-11,2023-09-21 19:38:30.513911,e08cbec7-248a-4105-bc4e-cd52e3c83853,"Affect TV together century player especially nor. Development newspaper but deal.
At arm decide seem keep. Election unit response. Author view serve win degree. Direction deep quickly type."
ee1f7d92-0196-4ba5-b6dd-ce3e37ec14a9,dbates5939,David Johnson,martinezbarbara@example.com,73acde9fa9ed2dc7b7b37222a2552983ef2cfd46d5275f4aa7c6199afcd87eed,001-623-516-9932,Svalbard & Jan Mayen Islands,M,2018-10-06,2023-09-21 19:38:30.514343,88edd720-bfde-4931-a20e-e95c8ce5d0e9,"Last themselves television. Least dream over camera month ask. Fish buy must over star rule. Certain likely laugh experience treatment improve.
On current return well. Business newspaper culture must. Wind expect responsibility stop leave."
6183d098-f103-439d-bffc-ebf472d2c8f1,dustin151852,Mary Gonzalez,carpenterdavid@example.org,a59dd61bfddbd694807cce1919fdced7f3fd54f609d8a4039efd6bfc86e4dd6d,3733780368,Guadeloupe,F,1993-10-24,2023-09-21 19:38:30.514781,866fb033-208c-4dff-9d4d-32e6a60e1e81,"Again clearly realize method west. She score force meet.
Dinner hotel already kind. Fire place continue federal. Win police suffer agree no require.
Tend hope believe. Senior since woman."
538fe701-2bf5-471b-8efe-33dafd77c7bb,wsmith5750,Mrs. Amanda Bradley,zcabrera@example.com,1fd87c12656ab2d04753e2577d827f5f9e05e93604150d5ce7e72316907ba5aa,307-790-9069x90452,Cocos (Keeling) Islands,F,2017-10-07,2023-09-21 19:38:30.515205,28fbe034-50e3-4769-974f-d5cee01b4936,"Surface set ball reflect should better into.
Space gas him suffer western minute cup. Role spend business listen live indeed home."
ce17202d-e27c-4b65-8d4f-4a5050b235b3,lindamathews7368,Daniel Sanchez,catherinethompson@example.net,43d549c5245545f616f4678dc50e4a8ca1413b3425ce62e05288a75e34e979b7,001-083-818-2322x942,Myanmar,,2018-11-19,2023-09-21 19:38:30.515809,cd7ab579-5a2c-4d39-9385-84eb16e6a859,"Song mention case. High main court least bad true.
Boy suddenly government increase address we down. Structure stay simply myself media similar within."
09387d96-403a-416d-a36a-1fe995f3540e,jamesgriffin9779,Kyle White,debbie04@example.com,684a7c62f90887d1b8b3388f3764a936c5b7dc5025da22ae59832f7522eed0f2,442.800.2775,Senegal,,2019-11-21,2023-09-21 19:38:30.516198,441eaa7f-7e6c-43ad-9629-80d06340e612,"Field project let herself pick. Amount give save.
Science least career dark others.
Bed fish middle follow image eight between bill. Policy house career. Identify population sea inside entire recognize."
c0946ef8-4c3b-44b3-b08e-f165dd70a58a,rosejeffrey2187,Emily Hart,michele01@example.org,9c0faeb2fb7587bee545e6f49927d95cd6df1a2cdf7d3b12d00a8263cff440a4,287.834.0439,Samoa,F,1943-11-24,2023-09-21 19:38:30.516574,bb4dde68-16d1-49fb-bbd2-0e4922ddc448,"Month whose yes subject. Professor rate military threat. Under network imagine control.
Able effect board. Bank detail pattern down economic."
456eb705-7d43-4d47-8f17-aaf715621f04,newmanbrenda5958,Devin Ryan,nprice@example.net,0865ac44a803755fdf8a8fbada2802fec9435d253922c7638245d52c0d00be1f,+1-727-601-8434x849,India,,1977-11-25,2023-09-21 19:38:30.516974,83cfd94d-3ab0-4a91-8faa-4bd4543e0dcf,"Fear local task activity more. Case player set.
Necessary sense drug method offer bit expert. Organization information season tough start head. Phone probably brother business own from."
a15b7d8d-2972-4c9e-90c7-a078f1460a17,anthonyholloway708,Alan Christensen,bbooth@example.org,8ed22ae488d0aae6510862b9e538c2c72bb9226c3b5e60fa55e6c5b655f802d7,353.503.2024x373,Ireland,F,1930-01-13,2023-09-21 19:38:30.517369,e6d147d5-c781-4e05-9d4a-2ba03eb8fa74,"Performance eat must interview PM wonder. Sea tonight million bad evidence.
Partner free ever nice million. Notice experience wish economic. Later spend painting side tree ground. Try society resource share guy have."
5d2ffd77-cf7a-498a-aba7-c712874e55ce,maddenshane7366,Robert Parsons,jacksoncindy@example.org,2160a10804f0b39c8235ddc51d91550d8077328bc0c53ed104d4659d751e5290,0554354038,China,F,1999-11-20,2023-09-21 19:38:30.517808,364efa46-16e1-43e4-9f12-211d647085f2,"Describe lose evidence. Same anything determine risk yeah call. Huge behavior myself lawyer continue feel.
Free over agree history fund situation. Hope stop child worker someone more suggest. Prove go while work offer respond accept toward."
cf88986e-c06b-4129-b05a-aa2f700ff6b9,ashley928127,Jamie Mitchell,brianreilly@example.org,56afda82e924074e955832622314cd37258692d5ed7485614e2ecb29e866ac69,001-161-934-6963x206,Turkey,F,1939-06-10,2023-09-21 19:38:30.518257,c7a20416-b10e-4db4-8bae-2bb3586a23d9,"Station star artist find wall scientist.
Until citizen option right small design decide. Know past mission body general leader attention.
Last into success particular second TV team. Could high theory. It page themselves first meet perhaps huge."
09abff77-7ff6-4569-b3b4-dcd261e12706,brandi747770,Virginia Kim,rebecca19@example.com,d7dbef4944bab5923560d91fa415d73fa0c150035d3db1a0cecdfd3f0882a014,042-177-1794,Fiji,F,2017-10-13,2023-09-21 19:38:30.518629,6d7169fd-95dc-488e-86c7-3082712f04b4,"As clear remember run exist feeling watch.
Heart listen appear clearly. Newspaper side American debate.
Message seem report bad hair. Particular operation conference price."
6faf7a90-2195-4f48-baa8-ec135ca61c43,amandasmith9724,Jacob Stevens,beasleyryan@example.net,639937fc0a65b4fb21c1464a16fe4ea909f7eb7d325faaa8991ab267e99459bb,(893)508-9822x2489,Japan,F,1992-04-29,2023-09-21 19:38:30.519078,30c3ad9b-74ac-4f56-bb5a-cea40dcd8345,"Nothing mother conference. From work purpose major just support identify.
Both certain fast I. Worry hour from why couple on many foreign. Because under key push pass.
Rate ready chair recognize heavy. Manage provide fire hot."
66285949-5d36-4353-87f8-1b134097b6e7,steven176958,Christy White,kaylahayes@example.net,cfcebfbefd48e671fe65e49febe0e47f8d67ffccaa9de8ddfb8609f52957ea9b,704.616.4221x7245,Uruguay,F,1928-12-10,2023-09-21 19:38:30.519526,eaf3702f-fdbf-4885-bc07-ec6e765279bd,"Property low each loss game various next second. Best none fly hair help dinner risk. Character life we base.
My continue agreement make employee season sort. Amount wait industry social affect simply design."
29072131-68ed-48d9-97f5-06355c5e1dc2,bhays9670,Mikayla Duncan,awilson@example.com,aeb76cf7bbfb51d89ac75d8fcc5c6be357960d840b0c6b90d16694014af7c219,862-392-4836x160,Isle of Man,F,1958-07-27,2023-09-21 19:38:30.519918,f0afd3ee-fa85-453d-b45a-05d7fcb5ac4a,"Long month recent voice generation.
There gun music even. Final although finish.
Tree far dark opportunity bill bed. Because quite wrong standard give. Public be series."
c3f9b7ee-34f3-4517-8b84-579f68b6a827,stewartkathryn4685,Richard Palmer,sshannon@example.org,8026925359c59c059c86bef1468b4e0fbd8c1c46aede8b36d15623a5617bc30d,+1-764-374-8777x2272,Croatia,F,2005-11-28,2023-09-21 19:38:30.520308,092e60d6-c560-450e-98a9-da6269c43c38,"Improve foreign around radio. Quality middle technology claim region middle window. Fly democratic wear strategy hundred begin.
What offer power education million skill truth. Five site four American senior.
Gun trial office avoid place common."
e96f2533-e3dc-4544-834f-105fc116cf20,nguyencourtney598,Ronald Reynolds,christinaramirez@example.org,37e7750e43ea078d949f7f25efac78981761cad635c945892996cddf5bb7cc5c,885-000-4863x5448,Vietnam,,1982-10-29,2023-09-21 19:38:30.520752,e86e5b00-a852-4dc3-aeef-07c994918cfd,"Address face whatever traditional ago apply threat structure. Million seek eat.
Meet number point produce contain politics really. According put receive standard music him."
0fd4e46b-c73a-4d6f-893d-64873040f8f9,evansdaniel165,Rebecca Luna,chowell@example.net,4e8fa75c9f1f6f61db58d3692064d0e24f618065662ff89e52cd41ab4eb5864f,969-836-4909x932,Ecuador,F,1979-12-01,2023-09-21 19:38:30.521141,c4fce35c-2ddd-46d0-af3d-652f42143089,"Purpose relationship policy experience meet. Doctor remember human decide.
Stand become month. Step citizen series room activity something sell.
Growth generation watch chance. Model response situation close computer good."
0ea14612-5718-4935-bba1-3f31a744b27e,stewartrebecca2293,Dustin Norton,daniellecox@example.org,6f68ea3689581f12242ddbf67d9a4661b3efea5a74f90bdd0e808fe76e8d465e,205.392.4840x75354,Afghanistan,M,1960-05-16,2023-09-21 19:38:30.521589,b4a4aa8b-34c2-462c-b1bb-c6c12fce471f,"Now everybody firm section. Situation approach tonight by story. North east both sense learn name.
Keep foot important describe simply maybe."
280df077-8dd4-422e-8912-10feac8f5cdf,williamsmargaret3328,Christina Rodriguez,angelacardenas@example.org,6b48781393cb4d37b3fb5609b5fda35af98068a47c98c1e94a45c609813be995,002.771.5105x889,Jamaica,M,2023-04-23,2023-09-21 19:38:30.522032,ce617c43-f551-4b81-963f-76f7e472cc00,"Door push as large. Idea build she north official.
Worry government key significant already special interest debate. Trouble per type sit range."
