id,username,fullname,email,password_hash,phone,country,gender,birthday,creation_date,pfp_file_id,bio
c8f36a72-b80d-4644-9b5b-dde04ae58687,bradleytimothy1042,Carla Clay,stephen25@example.com,4d2857338ddc8c15f7be58f04bc8c26fe0526dd65e57660d2efe87c52891f850,(461)070-7314x13113,Bangladesh,F,1982-05-26,2023-09-21 19:38:30.379157,,"Sing blue amount picture. Often general third serious.
Buy open skin back. Relate purpose certainly party well. Have serve operation can red.
Talk person discussion. And smile pick trouble focus future. Tv woman up enough."
01b6f1a5-109a-4da0-b81b-4b27c96d8bd4,patricia068082,Madison Stephens,harrisjoshua@example.net,df6388a6fd2cc6e98ba672d48f3726e3199d8ee7e9e3f916df303a16f8f79dfb,001-272-107-1034x853,Falkland Islands (Malvinas),M,1944-10-18,2023-09-21 19:38:30.379673,,"Rate two order floor contain enjoy. Have glass effect TV animal into. Sell production happen.
Few campaign teach both hard. Risk religious may team. Push yet professor blue white consumer."
1773eabd-bf07-464f-b61e-b46fa2ad0ab0,blackwelltammy543,Michael Moreno,kaitlyn33@example.org,ad9f603f7608c26f9c5d2a28acb16398e6bb1c427f55979b6c06193d8d0da73e,+1-778-775-2349x16841,Burundi,,1966-11-28,2023-09-21 19:38:30.380085,,Nearly represent often capital wall mention bring. Understand soldier would dinner check. Name manage forget watch popular listen work.
9088b9c7-65cb-46bb-8743-ea0ef3e7a282,arroyocatherine2201,Holly Wade,fgonzalez@example.net,87d9a4166f292a699ad75f6afd50cf33f34ec171d262b75ceb7f52b11b39c522,453.468.9600,Mozambique,,1946-05-21,2023-09-21 19:38:30.380469,,"Sign candidate later spring let expert black despite. Financial some family task move term. Professional opportunity history budget student smile big difficult.
Edge wait thank eye participant put ever. Also resource board letter commercial play."
1c080973-a5e5-4bdf-b032-12b3561e8af1,lwood2172,William Anderson,jennifermoody@example.net,84245e802137513311e1340afc282b15e1a80398da6f741d64c8a1632dabc454,774.709.7488,Moldova,,1939-12-01,2023-09-21 19:38:30.380913,,"Help enter probably car be officer wrong. Writer its hundred. Include town but especially.
Task small consider enough. Trip another I student. Participant stage near thing by draw factor.
My light billion later time without traditional."
b68b21ee-a805-4c44-a310-188adc6b2a15,alex521658,Stephen Rivera,garciamichael@example.net,540bca751270ce92dcec0af972e1bf3ca7009e1f4babf9f35c53ee1b62f48577,001-763-360-8480x135,Portugal,F,1979-12-08,2023-09-21 19:38:30.381370,,"Against between grow listen decide. Mother than catch attack. Hour reach watch water chance write manage. Wind focus learn reflect.
General attorney star against professor human. Eight single western director free hotel."
8e025746-5cc7-42d7-86a9-923d15aa5c94,moorecraig3325,Laura Oconnor,banderson@example.com,0f876ac2390ec2540e55c614912ea54bbd52efb2a236fc4f3185b74638cecd15,(487)358-2948x548,Eritrea,,2015-01-08,2023-09-21 19:38:30.381758,,"School child own fire. Parent collection avoid million. Offer forward sell protect. Civil campaign address.
Single question truth important significant second. Both campaign senior knowledge then. Ready decision live very real matter."
9dc9dce6-9e7c-4bb8-8db5-a7f462c4facd,amanda213333,Steven Pruitt,tami82@example.net,00eb4897ec243788fe3f6b2a4862baf775bf72be1dcf5352452bfac73fe3eea5,649-436-4152,Zimbabwe,M,1948-12-20,2023-09-21 19:38:30.382147,,"Other near career herself. Dark radio day grow bad sea word.
Effort public audience either garden figure easy risk. Smile cup drop heart turn impact network. Family them term make successful."
a7bfb64a-9ab1-47c3-bf5e-71ec25cc240e,parkeraaron539,John Waller,johnsondeborah@example.org,f8af8d0f722fd9df534c189fd637f924ea507882f5094e6d9d0b7ff6998e4825,(705)420-2545,Japan,F,1994-04-26,2023-09-21 19:38:30.382573,,"Home movie laugh heavy right discover teacher.
Action him future floor yourself middle live. Scientist house six green next role. Dream their case structure detail."
75cb57d2-6056-4ecc-866e-fc2bfef72aed,brockkelly4008,Christopher Beck,maloneshannon@example.com,5f582ee2b08de9f89c11bb2eb33d8c3aaf685730ffc84f86c9a81cb30898e5d2,+1-525-838-0242x38538,Cape Verde,,1932-04-19,2023-09-21 19:38:30.383010,,"Nearly indeed top senior learn war. Though federal level country south at. Drop front senior time any maybe.
Power daughter issue series against reach future. Plan about practice traditional them."
7c4a3c23-8408-4193-8707-8e2d6ac80086,uthompson7902,Brianna Mcknight,crosbyeileen@example.org,40a2733db54cc42e6db5b8a1f82ee47a5df8b49649740e318060c333efb86c12,+1-108-009-4649x101,Saint Pierre and Miquelon,M,1911-05-23,2023-09-21 19:38:30.383453,,"Eight act degree. Tend leader among same. Suffer wait you challenge able seven civil.
Answer wall describe ever. For because wide significant thus.
Meeting writer past necessary trial those. Nor place structure sign smile service."
202d536f-1bfc-4333-b6e0-6bf28d5515fc,eric656092,Cassandra Ryan,ashley91@example.com,06b641b653056868175314818dea73e534b87ed97d0f8792bdb43df97cc3ee88,+1-597-686-2603,Dominican Republic,,1932-03-09,2023-09-21 19:38:30.383836,,"Marriage much hand among high follow. Manage party candidate part. Same apply book less sort.
Garden born back near message during over lawyer. Together set per bring eight mind. Sport rest shake condition."
c07c967a-4614-4878-984e-de11e15fbada,rogerskristina4701,Arthur Rodgers,timothyoneal@example.com,a5eeca03cbd8d3442ffcc302b279e072ca3afb47ace1f935dfca162c06e6b293,130.803.5265,Cook Islands,,1931-11-30,2023-09-21 19:38:30.384290,,"Common role her know create follow fill wonder. West too woman else paper.
Star effect nature tree issue effect difficult. Benefit task far natural president.
Thing painting voice."
d0ad12fb-9f7d-4576-afa7-7c3a264a517d,munozbrenda3309,Elizabeth Wall,timothy43@example.com,7c2b9a5c8c6b188580934fe3eadbc5123aad39089aca6ce8ab02df6ac3e2aa3e,+1-395-396-4589x254,Azerbaijan,F,2004-04-01,2023-09-21 19:38:30.384662,,"Red policy first join. Management ground next foot.
Service room let her free ball decade. Despite whom foreign.
Situation partner size shake song perhaps. Issue dream federal away model. Reduce establish chance baby soon heavy study."
2050452b-6802-459d-a62d-2abc97b93318,hartandrew7848,Albert Faulkner,grayann@example.net,0b6e987fa44ab9820f450a23e14d643fc701f01a271479bd11f01c05c0f69df9,477.488.7846,Brazil,F,1943-06-28,2023-09-21 19:38:30.385223,,"Conference myself risk last never. Yes stay available young radio throw decide similar. His either admit interest.
Its against among. Agreement century feel purpose. Deep very serious response. Dark pretty natural sound."
f1a0e8c6-9a59-4493-ab7e-a13f97b24462,richardnelson1381,Walter Ramirez,dwaynejones@example.com,b4e67243a1d52bcedb1c6cbe80adfe7b28ad0c2858a0c3651805961258ce570e,604-129-9559x421,Bosnia and Herzegovina,,1927-08-19,2023-09-21 19:38:30.385762,,"Mr low director official receive idea. Source force most care figure pretty. Quickly billion home.
Fly these them first. Expect manager get four throw feeling."
b58df6f2-a5f9-4d6c-9e5c-7f17cb44c6fa,denise111436,Jesse Matthews,gperkins@example.net,7c52ed7ddf3764aafe301b0dbd2f6a45915ce39278be66618c5fd7ca8751fbce,+1-631-452-5994x5533,Marshall Islands,M,1962-12-08,2023-09-21 19:38:30.386173,,"Congress Mrs likely pay north. History ground general knowledge just deep. Walk glass pull individual media push senior western. Itself thought act star probably.
Really moment consider other order fine treat. Note dark its tax practice actually."
e306f354-0c9b-4147-9a25-aadb4a8c8958,anthonyjackie9243,Dr. Megan Kelly,sethadams@example.com,7acc82b92bba8c500c2765c8f01fa24e6c860ed5a4d7db2e04f10e67e73c544b,086-141-8929x1608,Armenia,,1912-05-15,2023-09-21 19:38:30.386626,,"State performance play fast rate draw born. Talk poor part modern yourself follow.
Certain hit political step change. Born of safe. Compare evening arrive national action system."
a0abf6f3-c8ea-4d3b-969c-7195c0d4aedc,alejandro812657,Tracy Mercer,ryanyoung@example.com,fdc9c155c0652aff84081feb642b66dfb0991b70b29639474a35bf2ece0d5194,614-037-6432,Cameroon,F,1995-02-25,2023-09-21 19:38:30.387063,,"Apply son rich degree class far. Exactly particular individual special eye industry very matter.
Arrive close front happy stage discuss. Teacher certain fine participant whole.
Teach production bill try local understand size weight."
fc73632e-d0e5-48f0-9b05-81ded510ac32,nelsonjay5496,Matthew Lee,fmora@example.com,57f422b83c099032b55c886c64e69494f861563e0edec2924f26906543171867,230-303-2214x45222,American Samoa,,2021-08-08,2023-09-21 19:38:30.387474,,"American write break town tonight type sing better. Tend form check hundred interesting.
Serious art want arm prove project skin onto. Address interview around pick.
Claim throw gas consider. Language foot season."
c193fd68-702c-4a4f-a9ec-7e07894b002a,matthewritter7679,Marc Trujillo,stephensjeffrey@example.net,598322ee3d40a2122a76d63d7397ea8c1e3f7fa5eae6870d070cd93a5186b50b,+1-638-048-1725x9582,Canada,F,1942-10-17,2023-09-21 19:38:30.387920,,"Including soon me for stuff. One know spring public respond by throw movement.
Machine visit sure peace your. Effort make positive for success.
Politics matter certainly next trip doctor himself. Affect international skill arrive within again."
9fe96a53-8641-49c9-be7d-3daf7c1e2ef5,edwardsleah6431,Sarah Cunningham,james55@example.com,a59e705340b3dacae989241827d0e6e5966a0a087de1cbabdbc5b9ee071ddb2a,(296)463-9472x51362,Burkina Faso,M,1968-07-15,2023-09-21 19:38:30.388308,,"Service surface trouble write crime seven. Quality take family as sound.
After discuss good. Whole act tend provide think. Thing last out free opportunity some."
9542ee64-abc4-4b89-849c-4aa7a5a3a535,hernandezelizabeth7400,Brett Lane,icarroll@example.org,e1b64a8e497348f6bf626ed28b2213093e245c7c862a04ae5f220862e9fbd304,+1-295-594-7517x86257,Falkland Islands (Malvinas),,1959-09-18,2023-09-21 19:38:30.388699,,"Order matter serious still. Will hold where speech. State computer dark partner local road answer.
Social paper attention age hold very enough.
Concern ahead subject worry get. Worker benefit focus send sometimes manage bad he."
2b88bafa-551d-4961-8be7-4f82c6460b85,sophia678128,Courtney Rose,elizabethzimmerman@example.net,1a5faad1bb8b73f366b9b07ab12629a5c48e3a21c0b7ed3dda0bd7c8b8d275d8,(715)161-2533x153,Saint Helena,,1948-10-19,2023-09-21 19:38:30.389153,,"Civil product treat research carry show. Pass else operation later allow. House cost together which.
Peace ask view kitchen human financial. Available technology tax top chance science. Page more relate third difficult."
9350ae7c-dd19-4d48-81b7-ea15657ecbd8,vsimmons6141,James Monroe,xmartinez@example.org,21056a4714a57b7584adb26b697e7a608c9fe88f93c1a474e48a896353531412,001-170-142-7440x8604,Togo,,1974-06-10,2023-09-21 19:38:30.389543,,"Suggest suggest star capital. Course miss long my score have fire.
Business plant west site miss. Police pretty political study growth. Again budget heart dog fight address consumer."
c621a8eb-4126-4dda-b767-c04b26c317b4,gsanchez6681,Pedro Park,kyle29@example.com,6064a08ec408846e3992c78e76cb8885c77abaf62ecb9a6f78e4cbee01eb622b,+1-776-615-3253x85096,Algeria,,1925-11-25,2023-09-21 19:38:30.389919,,"Life relationship mission each trial. Up race purpose service staff.
Product capital prove pay current away. Lay visit call push audience.
Talk tell anyone cultural. Land speak instead fast argue compare sport car."
8d62489a-bf6b-4e66-9020-90365a3914f8,popedeborah7950,Elizabeth Lindsey,kristin09@example.com,128fc534ccae42587d45ae22851b9eb18d25325ddfb3da41d7d8dab428e0e45a,338-569-3318x0891,Paraguay,,1943-01-05,2023-09-21 19:38:30.390402,,"Customer discussion no future. Away least interview consider admit father. Brother couple or.
Thing likely feeling stand stock very. Any control south lead even knowledge onto right. Me find relationship respond effort simply."
42059ed1-f9bd-40d6-9415-257d092a6451,sgarner3816,Wendy Wall,ryan03@example.com,11d3c2db3af23700596e7751eaee4056a52687a53d0d475a1b9ae07df25a1719,+1-410-590-9876x48725,Senegal,M,1951-07-27,2023-09-21 19:38:30.390897,,"Lose probably free culture identify. Sea star may evidence after what.
Bring blood action rather need response season ground. Action forget today. Sit hotel record dark wish president together especially."
bb1e6d04-e306-4c33-8b3a-fb6698c111a0,haleyberry3155,Alexander Baird,dennislong@example.net,c75605f7879fc8a26aa2135ea74eea4cf8bef39c5c3fe8d0f034629e554c96b3,413.737.6056x21097,Burkina Faso,F,1946-04-19,2023-09-21 19:38:30.391471,,"Degree door focus cost mind notice wonder. Despite miss picture. Mouth tell strong when education suggest.
Direction interesting might myself reality even interview gun. Term life enough take according unit."
b073bf7c-f211-4885-b2ce-a864b97e676a,tschmidt1773,Amy Anderson,brendapalmer@example.org,89832222af7ab7d9bff554eb1c5b4e30a882e6fdd6fb3e49f2a8f0c64d803191,990.792.7661x845,Iraq,M,1955-08-27,2023-09-21 19:38:30.392126,,"Company expert current official election its learn information. News this military half that many task before.
Century at student dog. Single sea old majority.
Explain image old wife language plant trouble. Citizen treat even after threat win."
f0447303-f875-4270-81e7-7b387d8fe608,fredericklawrence9809,Mrs. Tanya Williams MD,sandraevans@example.org,ea076affe440592d309a1b53dd91cac56d38798ef1010165375120d8f5f659cd,731.888.6849x65902,British Indian Ocean Territory (Chagos Archipelago),,2011-05-07,2023-09-21 19:38:30.392679,,"Total final blue leave agree. Street relate determine social debate physical option.
East bit several. Course generation thousand decade interest big. Turn experience always they financial dinner."
324f73fc-254a-4b86-9978-d4114b427680,holderryan2981,Sarah Moreno,andrea71@example.com,9e8731ebf2c0bf61168c4dd5718cbed491d8c2ecaa3e579457093e4cb3aff106,001-227-229-0153x0024,Cambodia,M,1993-05-30,2023-09-21 19:38:30.393068,,"Trial reflect common enjoy building raise green.
Building station life address speak may white contain. Occur issue sell economic. Young join finally."
78566628-eab3-453a-86a7-b2bbd197b120,jessica459314,Lauren Hicks,porterjenna@example.org,ac71192b6db67ff539c3358b70829184f364626bb22b45386f7c3a4b86bb33f5,738.427.8876x96167,Austria,M,1995-03-07,2023-09-21 19:38:30.393502,,"It serious third person final. Develop purpose way society popular by rest. Less unit smile TV agree.
Community station way that it effort behind court. Hold there executive world record."
7fc02fb0-3a3d-4e4e-981c-60359015deda,fhanson213,Matthew Watson,patricia44@example.com,579fd0419afd64a44422be13a916a32ebe98119acb35c4133bc608c5a1613903,221.874.7654x0377,Korea,M,1947-04-08,2023-09-21 19:38:30.393891,,"Including safe upon manager. East right happy card need. Born gas affect together PM.
Raise his join one. Win law player question travel believe operation."
3c5177b7-2d8f-4234-a4de-c0ebda21efb6,dhancock2107,Sara Villegas,hooverjustin@example.com,d674ddbaa0659762475ed5a1cbc35ca5271491c949914fbdfb1f0720ef6769cb,091-895-4992x2135,Saudi Arabia,M,1962-02-27,2023-09-21 19:38:30.394329,,"Push along a social hotel ago buy every. Respond walk day group participant whom behavior. Else personal pay common picture.
Color buy nice. End city choose sister try color moment."
70d542bb-e7e8-4a57-8796-9784f1b3c3e3,robin149514,Jennifer Wilson,jamescarter@example.net,cdcc817845bcf6d0a74bdcdee7eba6ae02b21cbf3b1716c61d39d9f30b1e451a,113-787-5587x9241,Oman,,1914-06-19,2023-09-21 19:38:30.394755,,"Network campaign discover respond itself general. Consumer into less material. Network health agree measure standard cultural always.
Wind note ready clearly quickly. Exist last either nearly here."
372dbe6c-08e2-4c5e-8566-5a94084258de,mcfarlandrobert3867,Tina Morris,emily36@example.com,6a4166599a8d1d3e01426d4e7d1578565e52818455911a82dfed552798190f84,963-244-7486,San Marino,,1981-09-12,2023-09-21 19:38:30.395125,,"Commercial reduce great professor else arrive second.
Rise add follow source successful phone front man. Center civil state gun. Color wish forward fund condition. Goal music garden before century away six."
f9e405df-0c7f-433f-bd15-d4c048286e96,garciakathryn5533,Todd Hernandez,kimberlyglenn@example.com,ee342b81cfd44286a16dfe0483f67d58037474144c34756df66725b522044e1d,(697)722-0748x059,Sweden,,1977-01-16,2023-09-21 19:38:30.395552,,"Far operation including strong especially under. Myself Republican during anything today make place.
Detail real law sea deal. Maybe north either including baby free news. Another media whether final indeed quickly meet."
ed42b75d-a8ab-4e2f-9867-477598069e7d,wstrong7560,Karen Jenkins,jeffrey64@example.org,21b33c854fe80c2620b66430a5ae7d07b48785e51c6992b99275761ca3cff99b,(578)356-4127,South Georgia and the South Sandwich Islands,M,1920-06-20,2023-09-21 19:38:30.395932,,"Law voice Mr card admit. Purpose true that entire production stop. Film green throw become ago easy.
Important short decade later along. Deal other or over office fund collection."
aec9db7c-ce9b-4dee-9338-d94b33b85f66,xharris694,Christopher Wright,eddie12@example.com,31945cb6fa883994eb4fc6e0100629aeb8a865223779ed21af6dc45086cb5ca7,349.445.1668,United States Minor Outlying Islands,F,2007-10-22,2023-09-21 19:38:30.396296,,"Stock deal identify career take concern. Cause scene ready.
Future wish management cover meeting probably.
Language final decision tree professor. Concern deep cold party practice man blue phone.
Idea admit type door political maintain."
c7951fec-9332-4de3-9a3d-b6aa84a685c2,hkennedy6022,Erin Gray,shauntaylor@example.net,47c0e8afaf6dfc6639c2604ac5ec2cc49c80e756bfbe77057febb0d4788ff63b,5297243239,Antarctica (the territory South of 60 deg S),F,1964-08-11,2023-09-21 19:38:30.396728,,"Doctor cover station. Performance hard respond art account local Mrs. Represent long maybe majority growth century.
Vote course how safe. North quality many message. Difference ahead speak impact better debate another."
61172082-0678-4b23-a6b7-105761ce7a6f,yorkdavid9425,Justin Smith,sparkscheryl@example.net,5309464ec4df626bea8afd429c58583bc6876c4bf7d1d1a56d15f9b8eaad19d0,(279)094-3972x44137,Timor-Leste,,1939-08-04,2023-09-21 19:38:30.397176,,"Television whatever technology be force. Behavior buy contain wall friend.
Add well ok wait white. To fight entire increase. Bag positive suffer fire."
ac7872b7-bae2-4b3b-b4f3-7eb97501ba83,kimberlyhardy3936,Michael Collins,christopher06@example.net,05b6d888396d56a0eea084dbbdf4f466106477bc51963273089bef70b7f1548f,+1-285-529-1915x539,Saint Helena,M,2000-01-08,2023-09-21 19:38:30.397552,,"Him Congress hard head man.
Avoid white clearly. Best leg respond voice black evening another.
Know a paper meeting wind watch. Reflect explain responsibility believe program agent herself south. Former wide woman six long nor right rise."
46b16d99-0a44-4b87-9746-d0cfeca6f481,tracikim3360,Jimmy Palmer,kathynorman@example.com,ba461b3b44bed695bacc74d6be8697a0daaf9c985a187c3577d2061d35bdf3cb,(202)055-7896,United States Minor Outlying Islands,F,1943-05-11,2023-09-21 19:38:30.397982,,"Suddenly which dark event within. Eat discussion cup happy head.
Return both protect realize next. Treat rich practice project.
Respond book ago their range close face good. Better it should measure identify adult firm."
a4dbffc7-48e0-48d6-a43b-71a89810af32,malvarez4854,Rebecca Willis,manuel68@example.com,e41a365948c94e0e34e017d9917f26d60f3ce74195f1ed281cc8346c928f95e0,155-757-6586x6577,Tunisia,,1984-12-12,2023-09-21 19:38:30.398367,,"Enough article look let wear within. Item positive strong hotel next director various.
Together business check different physical just. Artist TV thing cultural spend.
Ten real current food success war consider. Before night consumer back difficult."
302f0ba0-a1ab-4ee9-b659-5d66c251c1f7,triciabennett9219,Natalie Coleman,montgomeryandrea@example.com,509cbb7fd811525c75857a72e3a23ac2d59bc2d5a4252cb74297b2ab423cee27,487-613-0060,Andorra,,1975-06-01,2023-09-21 19:38:30.398808,,"Relationship soon heavy upon learn allow identify. Industry method official example price teach. Treat remember law together memory until standard.
Record chair for indicate car. Gun fund stand."
b0dfd5e5-a8c6-48b4-95d2-ee9ba2164267,wilsonrebecca9849,Kelly Ward,amywebb@example.com,26e8d1cd9542e83e375fef2fd8c510ea786a02dd0ce2acfa71d653d2cc5973c0,(293)207-5500x660,Norway,F,1988-01-12,2023-09-21 19:38:30.399239,,"Brother away crime. Upon main authority prove.
End exist food southern across relationship reality arm. Under worry second next prove home."
0d97bdde-e2c9-43e9-a336-f63fbf5998f3,ricebernard9721,Rebecca Wilson,wrice@example.com,a00f8ac634d71a12c737b9d249f73d272d4c587fe3b8559d2105f30a31c61e88,001-575-255-3528x45972,Namibia,,2002-07-23,2023-09-21 19:38:30.399628,,"Increase behind market wind figure the. Direction what consumer mean international not.
I control grow treatment. Sister thank behavior treatment community long. Everybody middle west listen continue. Situation where old more despite security put."
4be3ea84-1dda-4dab-806e-26735e65b824,hudsonjustin6177,Russell Rodriguez,michael44@example.com,e023acefe982bf086e3b90069357fda14145070cf6790067b2761d132641b833,(243)619-0650x777,Guam,F,1959-09-16,2023-09-21 19:38:30.400007,,"Ahead right field suggest bit ask reality. Defense example traditional alone lose. Thought live government throw argue set interview.
Paper successful product leg end. Executive go couple school thank around job."
2a50402a-65e8-4874-ba9b-c9f735ac6777,fsharp7436,Jessica Griffin,mcmillanrichard@example.com,ac5f71f9c1742a85d64beea9d82789b8ccddc9798d58da3f45e2c586a7d74d13,380.148.3975,France,M,1928-09-01,2023-09-21 19:38:30.400437,,"American art environment member. Message some record own.
Pass natural indicate positive. Shoulder point common although. Perhaps rate move.
Film try hope late sign pass. Stock ask movie trouble play."
4e1a305a-d887-47f5-b6b5-608fbe00649b,justinbaker3301,Emily Hunter,kyleweeks@example.org,3ce5113243154d58d38a10c6a7293339a072dc5ec56b83ed8ae680a5c108c508,994.081.8053x6269,Brazil,,1999-12-17,2023-09-21 19:38:30.400882,,Into resource light. Care agreement score down rest travel of term. Front station measure car cut.
d21702c7-884b-4e8d-be2a-9f807eeab3de,alexandra239924,Lisa Cole,anitamartin@example.com,6e8ed49c5a8c68ef9ca10ccb587bc04607a1e3375c21b13250c22e3d619412c4,087.285.3618x759,Luxembourg,F,1942-01-17,2023-09-21 19:38:30.401429,,"Former hospital night everybody. Save end against road human beautiful.
Agent song role not treatment hotel. Within former later cup push."
27b01dc2-dfc7-4474-a855-d4e652c85343,bakerbenjamin5515,Amanda Obrien,jessicakennedy@example.org,7be31f328c652a9cea37a602602f96fdb31d1d04c5098d9c17129df34ad57c47,277.566.1723,Guadeloupe,F,1963-02-08,2023-09-21 19:38:30.401941,,"Blue guy put life theory. Will spring player possible health yourself. Until company man loss.
American truth Republican just alone Mrs. Position expect experience remain. If computer she feeling."
ea8f4a6c-3255-4213-b6ce-819cdefc097f,turnermanuel3601,Cynthia Torres,urichardson@example.com,a0ce08c6fd29dd94926082856e6daa191aa91612c67375ca3131f7da0fd1be80,092.576.9163,Botswana,F,2001-10-26,2023-09-21 19:38:30.402331,,"Power fast leader church professional rather physical heart.
Purpose although staff throughout oil enough sell. Mean whole better factor sport. Short heavy important live hope lawyer those."
523b0241-9e6b-471d-bc33-fe97f34d6061,susan266765,Christopher Webb,crystal31@example.net,3b6f8fab8ceecb297f019d84c067ed33e5651b4b495a1fc54e9b6a0f50e8e58f,7050508347,Colombia,,1978-07-09,2023-09-21 19:38:30.402681,,"Him my manager style cold send entire. All long thing side coach above.
Central hope my bed west thousand buy rise. Sister time long we her anything send. Whatever near share."
09d1620b-dd03-4579-8e29-a4fb1c778312,juankline4400,Aaron Nash Jr.,johnmunoz@example.com,73921e68a76cb43d2c429f339ea668f29f20e46424a79dfaeb9c5966889245e2,(840)738-4661,Belgium,,1951-02-12,2023-09-21 19:38:30.403127,,"Thank bed kid either no price during. Film base fine much. Should hospital operation yet discover structure set general.
Believe value grow store. Work he know pay Mrs. Political born treatment."
4e7f2fb6-d859-4f3f-8de2-aab95d8df787,jessica424579,Eugene Lara,cynthiapotts@example.org,27f3aae20d26edb51d30acb59ded9c517b3d82982ce105f573c71c802f6c13ab,(991)924-0797,Peru,M,1918-09-13,2023-09-21 19:38:30.403557,,"News allow appear. Value involve treatment executive sign smile.
Little leader mind short foreign husband. Draw commercial something in citizen.
North school likely stock face store who. Yes any here. Year action everything building white among career."
b05c4ab1-096f-4417-aef3-9e1f5f571795,grose2673,Elizabeth Stokes,acarey@example.net,76a12037fac98a0daeef005db5aae0c83f3139ad612408c32388d35a1d30b27b,+1-019-741-5487x041,Yemen,F,2020-07-05,2023-09-21 19:38:30.403984,,"Only set than prepare current child talk. Only political audience dark question plant. Perhaps create first fund around discover tell. Short song without blood.
Second suggest seem once personal. Front subject rather."
55ab1a16-8c41-4464-b2f1-4692a235497f,travis53790,Rebecca Smith,raymond07@example.org,8de61e28564fe9ca8188f9e3a5fddfd5012e43295a8f570387156a6ce4f4d3e3,+1-692-856-7660x2746,Jamaica,F,1933-11-09,2023-09-21 19:38:30.404361,,"Authority green throw ok side standard sing. Suffer official southern leave. Game meet produce weight likely every carry.
Alone yeah foreign Mr threat score. Remember one bad decide reach half suffer. Finally factor onto late look."
