id,username,fullname,email,password_hash,phone,country,gender,birthday,creation_date,pfp_file_id,bio
24010ff1-d353-4600-ace7-2a335fca5008,nicolesalazar8069,Felicia Thompson,iyoung@example.org,f2a596f44658ec90e24afb51488102d63313f5de5cfb8edf177e4632cc83d098,120-113-8711x814,Maldives,M,1961-07-16,2023-09-21 19:38:30.592654,41fa6a69-1ffb-4d08-81a0-dc9d2727ce12,"Allow name cultural of very against chair. American born mind exist teach visit threat though. Quality Democrat act many blood evidence majority.
Hair together four nature task usually."
15bca19f-2a36-4ce6-8517-c64b787727b5,mendezadrian8202,Christine Collier,marierussell@example.org,1f84ee949a44a8488a69d4cbfef06750e8963af4fbad6acdd2d5ef8692f30b42,721-801-1631x7061,Gibraltar,F,1943-11-18,2023-09-21 19:38:30.593097,91c5160f-be0a-412a-9edf-6bf18b14fedf,"Old five capital situation door top four. Ever method page tell teacher source. None lay place write least almost its.
Since quality ask affect throw. If appear matter support. Although economic peace remain rise type."
cddb40fd-1262-4782-a7e8-484c44324bd5,krystal048560,Jasmin Gardner,justin51@example.net,319e543194bc2866ff85931c438c1424600a354b80d761efa6a917d65c9c8c35,+1-478-354-9672x54885,Macao,,1968-05-31,2023-09-21 19:38:30.593471,66d5b79f-a2fd-4d6f-9b2d-65acbbf6d4e6,"Factor speak large race firm. Hold brother leader article form among across.
Above full bill memory institution data become. Explain great special talk live almost. Myself lose well every."
3a5bc034-11b0-4721-9978-9eae0d612f5d,mwatkins7194,David Hawkins,patelmathew@example.org,bcb6b8bf66d804f001c0d9a3b58116cda70ffda91d3d9c5ea51cfc32a5e8f577,145-545-1787x71777,Cote d'Ivoire,M,2021-09-20,2023-09-21 19:38:30.593910,441eaa7f-7e6c-43ad-9629-80d06340e612,"Born take century however effect nature spend color.
Our worry great save support memory common. Turn more local into first traditional.
Truth of condition happy. Carry girl life live tonight specific figure out. Television way tree window benefit."
2ccae71c-4e76-437c-b06f-3b3f3be914e4,edwardsjoshua7197,Ashlee Stein MD,alexiscollins@example.net,2d150bede8f71ffc4ffc352c8cbc832a0ae3c7fac4d73454662134830a30e8af,001-341-951-3529x601,Niue,F,1980-09-25,2023-09-21 19:38:30.594366,e6d147d5-c781-4e05-9d4a-2ba03eb8fa74,"Shake least thank. Produce gas behind against. Ball big charge environmental religious.
Try where shoulder back. Offer sometimes bank drug where very know. Trouble who hair might two minute."
bb56981e-0762-4e9d-b5f5-3a4d7df835c9,bradleyhammond100,Alicia Velasquez,brownjennifer@example.org,8400db83ab6b1293037f9e1c4ab686b017c649df61a4c8e65727fc2e95d27a79,2982278471,Lao People's Democratic Republic,M,1971-05-20,2023-09-21 19:38:30.594793,866fb033-208c-4dff-9d4d-32e6a60e1e81,"Majority heart common lose security true though. Step no friend sign then.
Since hope marriage democratic simple positive. Poor state show development. Former all tree simply land."
4d9a6cf8-7807-4faf-9148-a02ca0c01dd0,vincenttracey7630,Kimberly Reyes,nicole39@example.net,7621f959bffed76cf60c3735cddb557d379efb7a5201b9d753d6608f01ba7c6b,580.956.1900,Lithuania,M,1987-12-19,2023-09-21 19:38:30.595168,2491d0d2-64bb-4628-a0ad-17d322e3c876,"Ok time power animal.
Door determine late religious large general. Learn final hospital expert day argue thus. Next about rate improve. Reach camera deep trouble else.
Wish seat else save instead. Operation need pretty type care site."
9a73343a-c077-45ae-a138-84bd96b27560,uellis6373,Matthew Lozano,leonardmatthew@example.org,d029c633c319bc8785e30fb005ee8946f9ae7d842e0b26a2e7855517d4fb1a04,7963287901,Bolivia,,1952-10-25,2023-09-21 19:38:30.595599,d50309fc-c4b4-4dc2-8cdd-174e82ffbf63,"Doctor single treatment.
Care ball federal generation him special way. View issue small suffer American tonight air. Owner industry attention language grow common point."
ecd65492-bf14-4833-8613-e1ed4d2d3e20,foleyjoseph8528,Rebekah Lee,richarddavis@example.com,1ac94950d3648f4a635e5ec1905ca6b6c556fe561e151b3e4fd92473a89767c3,+1-706-309-8819x01397,Grenada,,1995-08-20,2023-09-21 19:38:30.596052,73cba461-5271-497a-bfaa-741e5bfe9fb2,"Together her be financial. Believe claim much second save. Congress care before occur test.
Prevent rather he after particular author although. Policy total black very add."
e695e377-3137-4d0f-a212-f8a2e51c4c20,qmorrison8408,Vanessa Joseph,bryankatelyn@example.net,63b03282ef5fac395259c1656b5817c9005bbd752c3d8667ddb18ecd21f7f546,192.781.8936x591,Albania,,1961-02-04,2023-09-21 19:38:30.596492,893b4521-ea09-4ffa-b21f-0b9e7259ef62,"Everyone plan under threat choice. Particular effort report fly tend evidence. Try investment imagine chance old view.
Least able lay though walk between mother. Three change turn employee."
25a20fe1-c990-4034-9353-58bec85b2943,carlshort8230,Christine Smith,zfriedman@example.org,e9986190bd5a6b2b09e5f6750f558d615e58a09458f790b4cc8e24bb8f477f0c,001-395-868-8153x53621,Barbados,M,1962-10-28,2023-09-21 19:38:30.596894,866fb033-208c-4dff-9d4d-32e6a60e1e81,"Discover smile present wonder others.
Million continue should hard part fire. Start medical reflect like response Mr.
Strong catch near area. Site us size room at lawyer customer. Arm inside east without safe need if. Sound school us never."
c6d2227e-8420-41f9-8de4-c2f0f43e8021,johncastro8949,Meghan Thomas MD,alyssamurphy@example.net,8fd3ea4b473f6025f4e026feaf46c990a2edbcfd7e51a3ed4c6b4bccc6a06bf0,841.627.9935,Greenland,,1998-05-11,2023-09-21 19:38:30.597351,5085dcfb-012e-4fe3-8ffe-7259d89f541f,"Most high because enough. Idea interview seat many a only sort under.
Dream occur learn buy bring. Relate operation activity little society yes."
5fbe6a26-0183-4486-96f7-a0adf94ea7fa,deannaroberts9996,Amy Delgado,bcampos@example.net,33e2f8cace134f35cba156443309d2409019bdf289a0174021745956ed8ff112,652.257.4445x930,Russian Federation,F,1977-12-22,2023-09-21 19:38:30.597734,e86e5b00-a852-4dc3-aeef-07c994918cfd,"Small collection ever mouth keep bring eye book. Remain just speech toward practice want discussion.
Nothing west head paper newspaper at enter. Better make with later prove leave."
5ecc8dc6-b1a3-4074-a5bc-707a4b0c276f,josephhancock3604,Mr. Jason Jones,christophercasey@example.org,64520ed1088ef9205aacb4221d07f16e5c8490b43d941c5960b1631b258ea740,(296)796-2013,Micronesia,M,1910-06-12,2023-09-21 19:38:30.598174,ce617c43-f551-4b81-963f-76f7e472cc00,Put industry argue however sound late anyone. Miss wait specific control opportunity little worker close. Special poor consumer recently window federal central how.
b769055e-7e98-40f0-8868-f1688eeae2f3,smallsusan1790,Melissa Johnston,thorntonthomas@example.org,7e83ce5eabc86ace6115bb980f78f846aefd8057a8ecd20a36d5f106615f6929,4148844260,Samoa,,2000-01-04,2023-09-21 19:38:30.598595,0a7e571c-fe18-4781-89f4-77f076350ef9,"Nature during resource follow. Yourself of reason whole interest.
Yourself arm kind shoulder. Risk indeed four during relationship yes character. Series probably represent scene."
638a597a-7c87-4c30-b8e8-aa65ee7c2c30,brianperez1710,Elizabeth Chaney,aaroncampbell@example.org,63c0b7caf31138da1f97b8a158376c41d36fbb6524d309fcc0cb23a76befc6f8,(576)181-9753x20087,Croatia,,2012-01-19,2023-09-21 19:38:30.599040,ce617c43-f551-4b81-963f-76f7e472cc00,"Reflect decade anything cost story protect professional drop. Adult side pull like suggest. Indeed rich blue.
Try citizen book. Clear with save sell very participant."
959b640a-80f8-44da-9f65-6ba4babc9591,cookegarrett5713,Tracy Alvarez,vhamilton@example.net,d0b01d27d2056474fd14be96788e59312a86519247aa9f73a76236aa724d876d,(503)969-1727x37644,Greece,F,1962-03-29,2023-09-21 19:38:30.599438,eaa6daf5-fdc1-4da4-9765-93225acfdd8c,"Coach father fly style fear floor. Race matter play machine account. Claim hard whole new anything writer.
Medical note try approach subject. Option tend whether loss. Project throw language hard possible role. Few safe stage especially store low."
b445bead-8d6e-48c2-ab97-375b3917a7aa,fishertroy5091,Donald Lee,wvillanueva@example.org,4012f5bc41d2da262729469d48383af89ebe5e62b65de1f2e168617816e19555,001-566-256-7204x04823,Kuwait,M,1939-07-12,2023-09-21 19:38:30.599848,db061469-26e8-4440-9c3d-531025b1dfed,"Discussion fire smile how not thank. Under ask matter energy generation street. Leg TV people term speak boy friend follow.
Degree price billion year simply look. Describe whether receive anything. Be too meeting art theory doctor."
0ecfcd61-da96-4fc3-aac7-e63940df7853,courtneyburch2140,Adrienne Levine,bobbaird@example.org,8f44f9162c67ab5b4b6051d6fa93ed84234c8760e57e6178886e411ad753625d,(559)366-9112,Switzerland,M,1926-11-15,2023-09-21 19:38:30.600286,88edd720-bfde-4931-a20e-e95c8ce5d0e9,"Describe thousand boy work home.
Fund person his shake represent southern. Term west once black certain TV reduce.
Degree environment entire behavior. Either pull indeed wrong create network."
cf1517e8-4283-47f1-83de-2f849e94ff23,casey833755,Roy Parker,andrewsteresa@example.net,924d79f81755831aa33e25b4b402855e7863d04eddf17e39bb5b6d02d6f4e500,001-043-228-6186x035,Solomon Islands,F,1989-03-11,2023-09-21 19:38:30.600718,b84c8891-f142-490b-904f-666f4155b21b,"Doctor medical offer allow sound ok.
Discuss hospital store chair event production door. Us beat social decide theory. Sure character power same. Rise factor country job either.
Sell book like."
ce5ce298-9e5b-424a-afa1-f72d0ffa6327,psullivan6566,Amber Henry,ysanford@example.org,7c99388cff74fab5b336b83af80ef8139fa79b493c67227deee81e5a274b2552,9984190213,Sudan,M,1953-04-21,2023-09-21 19:38:30.601118,0f113b66-cea5-4d3d-bf70-3aaa433f10cc,"Prevent whose doctor affect seat reduce size. Pm TV use scene partner.
Yeah her artist include professional or interesting window. Final structure natural national anything reduce. Respond physical site oil."
d6ee4bb3-b150-4d00-ac5c-4b1c1692ef15,kingamy3736,Christopher Carlson,tina32@example.org,6f777df6d54a29832501149c2ad7eb5f69872748d4ae68dd1d701c5b75a2473e,9174467422,Lithuania,F,1975-10-23,2023-09-21 19:38:30.601467,c2884246-14ba-4ab9-a63c-8ac837fb673d,"Available name call director though pretty. Remember art sure.
Officer book bad road why decade. Sing order while do firm all. Another have pressure when center interest. Station allow blue."
1dcd33b1-a3d8-4dbd-b589-816f29150288,gomezmonica2539,Jose Ramirez,josephbrown@example.com,b605c35052d987b5108c3a02f4f5072c055b6c4b96f529bafc8193e4dafc84d1,376-963-9337x92601,United States Minor Outlying Islands,,1943-08-10,2023-09-21 19:38:30.601913,75b10c11-f2fc-4cb0-9d54-0626a24c18ba,"Provide business soldier design.
Practice wonder cover society recognize. Prove film rock billion.
Between treat inside production behind. Impact choose positive. Speech show wear age recent military."
a2ceea3b-0a96-4bda-a14f-9aa5acbf76af,jennifer841144,Christina Rojas,debbie53@example.net,c99cfc4f58eb7a022021995e44c3f313d7458159d1221ccea2a06b15cd197deb,001-560-530-8835,Zimbabwe,F,2021-03-11,2023-09-21 19:38:30.602287,161c6a94-1947-4b57-ab42-1d44db065157,"Feeling seat idea everything be cut entire. For garden throw piece stage tell suffer. Address cultural movie become health community final.
Success scientist money international. Former music deep to sign. Perform full church simply fund."
f6215d85-0ddf-483a-9fcf-2fef5c0883d8,phillipsgregory9074,April Waters,tracyknox@example.org,458415de9f2a90526c9b05ab7b7af61837db44419d61fd7c60dfa82fe3dc0c60,001-995-343-9554x48664,Gabon,M,1983-07-05,2023-09-21 19:38:30.602727,092e60d6-c560-450e-98a9-da6269c43c38,"Second reduce newspaper position move over. Next clearly recently leg like.
Nor million grow according forward trade. Million blood strategy international. Pull majority suddenly take wrong beyond."
02fa8296-97b6-4ab3-9ad6-940ff2a5f47a,martindevin43,Justin Crawford,murrayangela@example.com,b3ab837647bada74986939aef5d71bbb7596de589d25e26f4e5e860d29c6f304,973.616.3875,Eritrea,,1954-04-30,2023-09-21 19:38:30.603165,718d9d79-097a-4ff1-ae86-92816f5aa762,Shake bill research if particular cause share according. Image likely value central rock doctor attack. Its guy history cause full range hair.
adf61c07-6b2a-41c6-b3bd-37c17e1d172f,iduarte6543,Dennis Sullivan,johncamacho@example.net,5a388ca1d0a2a38fedecbc53a4b50bdd95ebf0e7e43882ef7390253b0c9bbec0,(546)490-3356x78726,Maldives,M,1986-12-15,2023-09-21 19:38:30.603591,5481f72e-64e5-4bc7-b78e-b4bcd109ebfb,"Avoid economic understand. Least technology Mrs.
Threat magazine hot night. Sense church life prepare.
Tell administration population last left major box. Leg heavy single option. There between treat election community top political."
f010e5b7-b016-4844-ad11-138a9abfa723,theresasheppard1931,Gina Whitaker,betty69@example.org,cc54675259f9bf4b140d95504587ba78a8c714d74babcd3cec0c8009b9465e8e,(063)536-5565,Tuvalu,F,2004-08-15,2023-09-21 19:38:30.603988,6041070c-cf9b-42ae-bc1e-92fb74fab9be,"Bar issue high it situation risk. Analysis glass artist.
Day question loss choose radio daughter. Finish increase perhaps finish often lay age. Employee herself thousand next.
Parent bad ground career born. As former trial small rest."
28d56098-01cd-4017-a0cc-48f6bdd5e8dc,powellsarah8520,Jerry Davidson,tatejacqueline@example.org,69cbcaf4d2cbe29747ea50b08a83686919808a6b0ba1a8172f5143b376f1d566,6471597678,Falkland Islands (Malvinas),F,1923-05-03,2023-09-21 19:38:30.604418,8142bcc4-5ace-4f27-a456-0c830fc38115,"Most piece pattern similar kid common. Talk argue even finally opportunity quite.
Quickly keep office support. Lawyer mind so provide book speech simply. Cover third base generation note boy. Dark friend southern your simply chance."
9b944a7c-adb9-40fb-8e83-e6a44b19ee61,mgibson1501,Martin Hayden,yolandamartin@example.com,18874de840bee2f0f4e0c098a1eba75ab024696e65d8f2a90a56716b12d67150,+1-795-605-2691x9801,Philippines,F,2020-06-06,2023-09-21 19:38:30.604860,441eaa7f-7e6c-43ad-9629-80d06340e612,"School political oil today. Into successful street treatment way single.
Admit political full front year thought. Hair act simple majority participant.
Always follow yes serve. Citizen board protect have down thought magazine."
25862e5f-2d9d-416b-b778-4f9a3c378cad,mhobbs5617,Ana Johnson,edouglas@example.org,145b0fd1370cf44f9e48cd31ba9df8f11505ef562b605ccd9e3bd315d322e4da,227-037-6663,Iceland,F,1998-07-29,2023-09-21 19:38:30.605257,718d9d79-097a-4ff1-ae86-92816f5aa762,"Their while value audience million themselves.
Evidence decade eight hope control her run. Father summer not yourself place room. Truth majority manage reduce edge either.
Help its stuff everybody push middle kind."
5437e425-a458-41c4-84fc-2e6d10d906c9,alice75655,David Wells,diana06@example.org,f63e41a08c507e802b67fea3ae7fbe76faa98489a55831b2bb11d6389663e6e8,+1-069-365-1194x6701,Poland,,1935-08-13,2023-09-21 19:38:30.605613,68062038-bb68-47da-9170-11048a8fbbf6,"Series during tax upon response. Support class deep whether.
Test conference certain. Share direction tree more. Laugh west determine turn prove people."
d14e9c6a-b9ac-4cbd-a96e-ff1263ffa956,samanthabryant6945,Jeffrey Thompson,seanparrish@example.net,793611b3cf1de2389468c2d1a5f4ef71a37b51dc37398608d77c167d33553935,874.165.3273x87236,Zambia,,1979-11-19,2023-09-21 19:38:30.606055,718d9d79-097a-4ff1-ae86-92816f5aa762,"Government hope pattern necessary tree. Employee pull more mean health. Station consumer discussion foot week focus feel. Program machine much current.
Story maintain require staff. Price sit technology. Lead his quickly wife. Start right six."
564e9990-e2be-4e79-864c-8ca406ff5b63,jonespatricia5113,Kathryn Garcia,padams@example.net,953bdd48e088b663999b8bae9f1549271fb14e6f50793f0ccd97bc2bb5e6efe2,790-271-1527,Aruba,M,1929-06-26,2023-09-21 19:38:30.606466,68062038-bb68-47da-9170-11048a8fbbf6,"Ability example long else. Full would whatever politics wide south writer arm. Yes window stage decade book other those.
Week tonight light area on need. Training approach particularly result statement. Fine citizen area sure soldier."
5ef2b68f-d202-4f22-8c8e-104ee77930a1,raymond198324,Michelle Miller,margaretmcintosh@example.net,7a32a8bb12e5b9639ffc687478d6d381637f47e620c631fdb401beb3ea346b5b,531-098-2176x5643,Ethiopia,M,1942-07-07,2023-09-21 19:38:30.607034,5085dcfb-012e-4fe3-8ffe-7259d89f541f,"Subject dark beyond cover director grow. Third individual real. Simple mention indeed among matter news.
Laugh child pay rise. World attorney size peace. Analysis bed imagine sing."
098368ba-8a26-4655-9f82-deb1d36796a5,ojensen495,Willie Ballard,mullinsdana@example.org,368f8e1529beeff5d400c91dd0191157e0c33fb50f03d4d41ed0144c02d44535,(796)119-3116,Saint Vincent and the Grenadines,F,1957-10-01,2023-09-21 19:38:30.607573,d18aa40c-77a2-401c-8cf1-ae5ba1abcddb,"There deal wear west. Huge could event dark enough shoulder man fact. Many take field interesting perform.
Color make style city. Often fish decision thank media clearly. Source bad you mind."
0c4c301a-96fd-4e23-a57c-c24343b83225,robbinsbryan8756,Alyssa Fleming,zhill@example.net,1540c621e5445a05a1d15bbc14ade87001b206bde96a281ef9dfbb0eb4e99565,+1-179-129-4355x2477,Chile,,1953-08-17,2023-09-21 19:38:30.607994,18290c76-2403-4777-8d5f-1b72bb77919e,"Thousand rest quality may control service agency. Improve attack industry born police.
Cause amount west several like blood. Knowledge time assume myself.
Story last protect north together need lead. Next sing for receive."
f55f153b-0016-4b18-87ea-467da1e597b7,longedward774,Brenda Deleon,ycolon@example.com,2203837bb5061f176361c48bb889654c19207ad1531d72870d9d6a993babea3d,9175503512,Aruba,F,1936-04-24,2023-09-21 19:38:30.608390,8e7a6b4a-8ca1-4689-8ac3-4ba942a9835d,"Sit tend maybe sense include beautiful question both. Fire performance student sign once factor individual air. Trade identify against black include.
Source PM agency common. Service scientist arrive suggest born. Whatever these or little."
9532c184-1f51-467f-8818-b8752e61707d,jacqueline78203,Krystal Dorsey,schroederapril@example.org,b89bf054e38dc2cb28f363a580cf1c902f0f9711391761e2c9a934489c1ff25a,536.967.6822x833,Solomon Islands,F,1945-08-01,2023-09-21 19:38:30.608829,914943f2-6747-4995-ba9f-afd496e5e66e,"Back design work above after game baby trial. Name production police thing site pass firm.
Than yard friend very past information. Table firm increase idea space. Learn guess water word activity task wide."
fdf2e7a0-0e88-49b9-ad0f-a21bb5d754c8,gaypatrick6969,Erin Garza,olsondestiny@example.com,a918a8068453d46fced329bfd3322bd68476f3068cc543f21cacdbdbcf48a66a,(803)452-2857x3204,Iceland,F,1957-03-04,2023-09-21 19:38:30.609274,0e110900-c93f-42e2-ad8a-9b127dc121c7,"President television support could audience turn. Too certain investment data seek computer none.
Happy air right crime rest. Threat look job for quality skin manage.
Style age require budget. Cover power pretty stage nor him."
4e571b03-91ef-4a52-b1ca-c701193b1a18,madisonpreston581,Patricia Patterson,reedangela@example.com,cfde2ad205004147f25d0041c2af1bbec978bb1e6ecdd8077c5d2003e5134100,560.279.9149x913,Montserrat,M,1959-01-09,2023-09-21 19:38:30.609710,91c5160f-be0a-412a-9edf-6bf18b14fedf,Table since yeah require entire week. Return of hold letter someone attorney account everything. Place reflect factor owner far PM.
c6fd06ff-4b4c-4263-be78-998063d39ba7,nperry4098,Heather Robinson PhD,cbecker@example.org,bb18992dd0c83b9b1c13afba729775b2ae938aad17eaecd10f0a111655812e1e,001-679-869-7747x85335,Serbia,,1917-09-08,2023-09-21 19:38:30.610107,f0afd3ee-fa85-453d-b45a-05d7fcb5ac4a,"Owner student total war spend half house. Charge let wind turn.
Drug major after president. Attention media eat finally best today. Move hard improve.
Message admit skill great. Kitchen increase morning everybody myself."
a75d085e-35c0-4221-83fd-323e409f3500,jamesburton1912,Jack Pena,cmahoney@example.org,3bb8146de719bdf374f1715bc8159cffb4e160fee90ad04b7d691c260f8bb12b,059.997.9712x32598,Equatorial Guinea,M,1999-12-17,2023-09-21 19:38:30.610519,0a51fdfb-2490-4fb0-b6d5-9f40eff9ee3d,"Seek southern southern deep south tree. Try research push long ok front leader every. Meet save have forget.
Lawyer will Mrs eat current. Brother seven usually current. Go energy goal father."
c88990e8-90c8-4d30-a28b-f5cec4fe5629,zacharyreynolds5893,Lori Davis,xjohnson@example.org,5d90eb24383d3282dabffa00ef4feb07f719898129273804ce9fc2f882b36106,346.623.6522,Belgium,M,1967-12-27,2023-09-21 19:38:30.610933,718d9d79-097a-4ff1-ae86-92816f5aa762,"Red music traditional everything laugh. Stuff probably position similar. Dark reason end single investment set opportunity. No whose gas agree.
Another happy manage wish strategy. Go manage easy in. Really our natural matter environmental."
50dc9379-6308-42f4-83a2-9db0dcff74fd,tracy159547,Jonathan Rose,rfernandez@example.net,8023f060b08735a266ceca95939a3ffccdbf1691d4a999ee520e93148d7be3f2,001-701-683-0004,Nigeria,F,2005-08-25,2023-09-21 19:38:30.611331,e86e5b00-a852-4dc3-aeef-07c994918cfd,"Sometimes card lose decade on nothing dinner arrive. Message season similar represent. Personal page mention cut discover week education.
Authority Republican police. Mind because remember high. Break modern evening home our."
20aa940e-7adf-4384-ae27-b4f9b717803f,bobby338998,Gregory Alvarado,joseph85@example.net,2c0c2754cf7c282511401ce902018b995b277fa06304f26ac4aceb1c4e6b0221,858-544-5481,British Indian Ocean Territory (Chagos Archipelago),F,1948-03-01,2023-09-21 19:38:30.611703,f401569f-92a1-47ae-88a6-da620f69033d,"Line style economy. Control successful see. Main sit prove final wish campaign down idea.
Start certain young commercial consumer. Area daughter image. Expert side someone hit wind research some."
332ff1dc-e170-4a5e-8372-c4d4bcc91779,davidarellano6733,Richard Wilson,wmartin@example.com,8edb4467dc8f32b12fdb6169f15bc799555b0d08ea00bc1e11be269fe59a3f16,563.592.7021,Bermuda,,1916-06-06,2023-09-21 19:38:30.612111,893b4521-ea09-4ffa-b21f-0b9e7259ef62,"At ten option listen worker control attorney. Business set for full factor major summer. Send movement finish night manager program.
Any truth skill rise so. Respond consumer benefit young.
Total small hospital beat firm."
ca1696b3-d563-48aa-b2fa-7a165794e87f,martinezmark9710,Michael Gonzalez,kevin31@example.com,82ca323737598a5c78e4961b9465099cb337fa879aa63fa0e0ae15c73b072abe,628.773.7764,Bermuda,F,1978-01-07,2023-09-21 19:38:30.612479,b1f14783-45cb-4821-b96b-c0bd2a937a92,"Own strong quality paper network. Fill exist citizen some forward. Write grow particular six even. Listen go across issue.
Begin worry customer buy which. Identify those who attention Democrat rate certain. Station table under doctor price bag but ok."
d0d46db9-0820-4dc6-bb31-ba069010ee12,braunbrian5094,Brian Davidson,rebeccawilson@example.org,7804d92f54373913ff869ccffcd65944cba77c27b64073dc9352d8f23c0fb2bb,881.725.6275x2395,South Africa,F,1968-02-06,2023-09-21 19:38:30.612934,bb4dde68-16d1-49fb-bbd2-0e4922ddc448,"Purpose scene arm. Debate attorney avoid late agree church every wall. Lot impact speech agent.
Hot already seek explain floor low single. Sense think information level exist accept.
Skill simply thus half news feeling."
fa81c23a-bbaf-4737-8f84-88c02af92bbd,freemanlouis4863,Jose Vaughan,halljohn@example.com,0075ab3a0d09ef8c63ab339e4561445887c1e60349c836cab67830d4ab4e5a75,(075)793-9122x8618,Barbados,M,1938-03-07,2023-09-21 19:38:30.613370,d18aa40c-77a2-401c-8cf1-ae5ba1abcddb,"Four series hand writer big court respond police. Goal onto tax century government.
Let leader age. As join cause paper. Talk heart eight term.
Card expect mention computer. Score fire employee join it wrong. Arrive land close make guy."
47d0f115-2235-47fa-b67c-f67a40877ffb,zamoradylan1968,Charles Meyer,brittanyphillips@example.org,29878a6796f60d8c5c35ef61d2fa9500bcac4edf78477639b239bf14acf1c178,841.312.5974,Korea,M,1909-02-11,2023-09-21 19:38:30.613814,1e8d297b-ea85-4c30-8b93-4961a713c352,"Bad hard full. Why bad theory. It more treatment.
War consumer eight simple generation measure coach. Eat statement office character staff know. Trouble market environmental owner how."
24a68388-df1f-4692-b480-3590c753a3df,mark511686,Michael Martinez,richard99@example.org,f2f972185ce022aab5ae4008783e7dd56c62b724e560afe7efe76a8c46645e6f,408-241-2821x895,Belize,,1924-09-13,2023-09-21 19:38:30.614195,914943f2-6747-4995-ba9f-afd496e5e66e,"Course day concern including own bring line. Clearly speak offer student particular standard impact.
Century religious bill help consider. Positive agree bed single continue speak suddenly cup."
416d161a-d8f3-4f86-9ac9-54babed83b24,mhoffman6249,Misty Morgan,edward93@example.com,44ee27ef283e212a4fcfe1eb4fb333c2d16853cacfaa5da856ee42009054f43c,388-131-5525,Northern Mariana Islands,,1995-03-08,2023-09-21 19:38:30.614553,6423b9f0-cc3b-44c1-9ac0-8480034a3c9e,"More develop condition attack structure there carry. Begin crime where.
Parent white relationship lay everyone. Night truth accept enough sport population."
783b1740-9be9-4613-8cad-cb9f10a52a37,nrichardson9411,Jordan Mason,matthewcole@example.com,63aacfdd62132e9fe4a4f5208fa80ca161c23b8e03b8efac87f83c0c71d3101b,041-097-2887x5354,Iraq,,1990-06-15,2023-09-21 19:38:30.614986,18290c76-2403-4777-8d5f-1b72bb77919e,Outside exactly opportunity although trouble letter. Any second stuff food character such. Less not western education point sister sure.
805d68fe-7ab7-491f-94d4-ae7e7bd47082,dmoore3335,Michael Hall,hollybrown@example.net,08966a5ae03c0a2afa567a4e8a23658f8ca172fb04e40c7817fb14f0058ec518,3745258141,Monaco,,1958-03-28,2023-09-21 19:38:30.615394,ab46c3e7-ee1b-441b-a273-9f1a1e16f9f1,"Necessary just item magazine whose week read. Score close measure can evidence. Choice mother return test ask every.
Worry window water show even perform health. Company lose democratic may camera. Rich Democrat play charge surface thought yet have."
